Comment ID	Article ID	Date	Name	Recommendation Count	Body
CommentKey:18416256-176e-4ca3-b3e1-96d9bc394c72	2000415835	Mon Feb 14 2011 05:31:46 GMT-0500 (EST)	Obama Harper	21	it is about time. The people running the protest ( outside the country) got the change   Canada wake up and remove Harper
CommentKey:cf3a6dd9-f97c-4c30-abc0-c7359ddcfca3	2000415835	Mon Feb 14 2011 05:51:00 GMT-0500 (EST)	John Sollows	21	Yes, the protesters should go.  They have made their point, and it's time to let the country get back to getting on with life.
CommentKey:8bf7ea4c-5a27-489c-ae35-1692c3826bdc	2000415835	Mon Feb 14 2011 05:57:27 GMT-0500 (EST)	J-Practical	31	@Obama Harper   "Canada wake up and remove Harper"  At the next elections, we'll think about it.  Happily it's the Canadian way to let elections change our leaders. That way our army can do their real job, because our democratic processes do theirs'.
CommentKey:7c6fde9d-af0a-4b40-a7d8-007fd6d62e4e	2000415835	Mon Feb 14 2011 06:14:13 GMT-0500 (EST)	JM Smith	26	"military authorities were expected to issue a decree that would ban meetings by labor unions or professional syndicates"  All the more reason to keep the protests alive.
CommentKey:5399242d-decd-4ab1-8c32-2c531a62999d	2000415835	Mon Feb 14 2011 06:18:45 GMT-0500 (EST)	TravisTJustice	20	The Egyptian people still have a long road ahead. Hopefully the Military will do what they are promising.  Now the rest of the world still needs to support Egypt in moving to a democratic society.  Egypt this year maybe China in 2014?
CommentKey:f3fcae0b-cfb6-42f5-af5f-3060630c358c	2000415835	Mon Feb 14 2011 06:34:40 GMT-0500 (EST)	Your Mothers Britches	14	"Happily it's the Canadian way to let elections change our leaders."  - What pipe dream have you been living? nearly 40% of the Canadian electorate didn't vote last Federal election!
CommentKey:e57d038b-04c4-4541-816d-ce5be41e8942	2000415835	Mon Feb 14 2011 07:02:41 GMT-0500 (EST)	Canadian Viewer	39	Banning protests and strikes? Looks like the military is well on its way to leading this country into democracy!   Like i said in an earlier post - from the frying pan, into the fire.
CommentKey:4b4b15a5-ffe1-46e7-b989-7fb523499b04	2000415835	Mon Feb 14 2011 07:11:22 GMT-0500 (EST)	1moreside	31	The military has dissolved parliament, suspended the constitution & will be amending the constitution – without the input of voters or elected officials.  I may be a bit slow, but isn’t this called a Military Coup?  It may have been done in response to protests or the protests could have been conveniently timed, but the military taking over a government is rarely good news for citizens.  They are banning "meetings by labour unions or professional syndicates" (i.e. public meetings) & thereby strikes (a form of dissention), is the press next? So why are world leaders happy about this? Are they assuming a military dictator (no one has been elected yet) is better than Mubarak?
CommentKey:7049da1d-ce4a-464d-8a40-1d47a416c493	2000415835	Mon Feb 14 2011 07:15:46 GMT-0500 (EST)	Chatable	31	"Happily it's the Canadian way to let elections change our leaders."    - What pipe dream have you been living? nearly 40% of the Canadian electorate didn't vote last Federal election!  The number of people who vote has nothing to do with the fact that we change our leaders through elections.  Perhaps you could explain how you think we change leaders.
CommentKey:6f9a5825-c79e-45fa-b7d6-300891ea4084	2000415835	Mon Feb 14 2011 07:25:33 GMT-0500 (EST)	oclupak	2	"The coalition behind the protests has demanded the lifting of emergency law; creation of a presidential council, made up of a military representative and two "trusted personalities"; the dissolving of the ruling party-dominated parliament; and the forming of a broad-based unity government and a committee to either amend or completely rewrite the constitution."  - - - - -  All of those conditions should have been met before the protestors were "invited" to leave Tahrir Square.  The fact that they weren't is a good indication of where this is going.  The "international community" will not allow a democracy to take hold in Egypt, as it could jeopardize the absolute control it has enjoyed without interruption for 30 years until two days ago.  The U.S. and Israel will fight tooth and nail to keep things as they were.  Some cosmetic changes will be tolerated, however, such as holding elections. But these will only be allowed to be carried out when conditions permit, which will not necessarily occur within the next six months.  What is important right now is to crush the momentum of the Revolution. That is what we are witnessing right now. I wouldn't sleep very well if I was one of the protestors who had been identified and catalogued in the Secret Police database which, surely, is very active at this very moment.
CommentKey:fe730751-2112-445f-9215-fbd1b80ab75b	2000415835	Mon Feb 14 2011 07:26:18 GMT-0500 (EST)	oclupak	4	"The coalition behind the protests has demanded the lifting of emergency law; creation of a presidential council, made up of a military representative and two "trusted personalities"; the dissolving of the ruling party-dominated parliament; and the forming of a broad-based unity government and a committee to either amend or completely rewrite the constitution."  - - - - -  All of those conditions should have been met before the protestors were "invited" to leave Tahrir Square.  The fact that they weren't is a good indication of where this is going.  The "international community" will not allow a democracy to take hold in Egypt, as it could jeopardize the absolute control it has enjoyed without interruption for 30 years until two days ago.  The U.S. and Israel will fight tooth and nail to keep things as they were.  Some cosmetic changes will be tolerated, however, such as holding elections. But these will only be allowed to be carried out when conditions permit, which will not necessarily occur within the next six months.  What is important right now is to crush the momentum of the Revolution. That is what we are witnessing right now. I wouldn't sleep very well if I was one of the protestors who had been identified and catalogued in the Secret Police database which, surely, is very active at this very moment.
CommentKey:19062a0c-f521-4192-bb6b-e8c731b46c0c	2000415835	Mon Feb 14 2011 07:27:57 GMT-0500 (EST)	oclupak	2	"The coalition behind the protests has demanded the lifting of emergency law; creation of a presidential council, made up of a military representative and two "trusted personalities"; the dissolving of the ruling party-dominated parliament; and the forming of a broad-based unity government and a committee to either amend or completely rewrite the constitution."  - - - - -  All of those conditions should have been met before the protestors were "invited" to leave Tahrir Square.  The fact that they weren't is a good indication of where this is going.  The "international community" will not allow a democracy to take hold in Egypt, as it could jeopardize the absolute control it has enjoyed without interruption for 30 years until two days ago.  The U.S. and Israel will fight tooth and nail to keep things as they were.  Some cosmetic changes will be tolerated, however, such as holding elections. But these will only be allowed to be carried out when conditions permit, which will not necessarily occur within the next six months.  What is important right now is to crush the momentum of the Revolution. That is what we are witnessing right now. I wouldn't sleep very well if I was one of the protestors who had been identified and catalogued in the Secret Police database which, surely, is very active at this very moment.
CommentKey:95ac8107-82fc-480c-a53f-d96a910f401e	2000415835	Mon Feb 14 2011 07:31:24 GMT-0500 (EST)	oclupak	2	"The coalition behind the protests has demanded the lifting of emergency law; creation of a presidential council, made up of a military representative and two "trusted personalities"; the dissolving of the ruling party-dominated parliament; and the forming of a broad-based unity government and a committee to either amend or completely rewrite the constitution."  - - - - -  All of those conditions should have been met before the protestors were "invited" to leave Tahrir Square.  The fact that they weren't is a good indication of where this is going.  The "international community" will not allow a democracy to take hold in Egypt, as it could jeopardize the absolute control it has enjoyed without interruption for 30 years until two days ago.  The U.S. and Israel will fight tooth and nail to keep things as they were.  Some cosmetic changes will be tolerated, however, such as holding elections. But these will only be allowed to be carried out when conditions permit, which will not necessarily occur within the next six months.  What is important right now is to crush the momentum of the Revolution. That is what we are witnessing right now. I wouldn't sleep very well if I was one of the protestors who had been identified and catalogued in the Secret Police database which, surely, is very active at this very moment.
CommentKey:d30db1af-fdb1-454a-b946-1fd2d011b0e9	2000415835	Mon Feb 14 2011 07:33:21 GMT-0500 (EST)	LinaMagliola	5	This is ominous. Egyptians demonstrated for democracy, not for a military coup. We will now see if Washington's words of support for the pro-democracy demonstrators was just empty talk. If Washington continues to fund the army, then we will know it was.  But the young Egyptians who paid with their blood for this uprising will not be decieved. They will persist until they achieve genuine democracy. And they will choose leaders based on what they percieve to be in their own self-interests. Not Washington's. And not Tel-Aviv's.
CommentKey:87702143-55c5-4233-98c8-261893dc843a	2000415835	Mon Feb 14 2011 07:34:54 GMT-0500 (EST)	LinaMagliola	3	This is ominous. Egyptians demonstrated for democracy, not for a military coup. We will now see if Washington's words of support for the pro-democracy demonstrators was just empty talk. If Washington continues to fund the army, then we will know it was.  But the young Egyptians who paid with their blood for this uprising will not be decieved. They will persist until they achieve genuine democracy. And they will choose leaders based on what they percieve to be in their own self-interests. Not Washington's. And not Tel-Aviv's.
CommentKey:485b4304-e9c7-41d1-ace5-5fbfa3030ca1	2000415835	Mon Feb 14 2011 07:39:44 GMT-0500 (EST)	bryano	2	hey 1moreside haven't you figured it out yet?the canadian and the US government support dictators that harm their own people across the world, as long as they dont cross the US everythings fine. but them these same leaders here turn around and tell you that they support democracy and human rights when in fact they could care less their all full of it.
CommentKey:b7f11334-4f2a-4827-aaa8-352903dcc450	2000415835	Mon Feb 14 2011 07:40:44 GMT-0500 (EST)	oclupak	5	"The coalition behind the protests has demanded the lifting of emergency law; creation of a presidential council, made up of a military representative and two "trusted personalities"; the dissolving of the ruling party-dominated parliament; and the forming of a broad-based unity government and a committee to either amend or completely rewrite the constitution."  - - - - -  All of those conditions should have been met before the protesters were "invited" to leave Tahrir Square.  The fact that they weren't is a good indication of where this is going.  The "international community" will not allow a democracy to take hold in Egypt, as it could jeopardize the absolute control it has enjoyed without interruption for 30 years until two days ago.  The U.S. and Israel will fight tooth and nail to keep things as they were.  Some cosmetic changes will be tolerated, however, such as holding elections. But these will only be allowed to be carried out when conditions permit, which will not necessarily occur within the next six months.  What is important right now is to crush the momentum of the Revolution. That is what we are witnessing right now. I wouldn't sleep very well if I was one of the protesters who had been identified and catalogued in the Secret Police database which, surely, is very active at this very moment.
CommentKey:90a7dfef-c9c0-4cc3-a1d3-9f71edf035de	2000415835	Mon Feb 14 2011 07:42:44 GMT-0500 (EST)	bryano	2	hey 1moreside haven't you figured it out yet?the canadian and the US government support dictators that harm their own people across the world, as long as they dont cross the US everythings fine. but them these same leaders here turn around and tell you that they support democracy and human rights when in fact they could care less their all full of it.
CommentKey:061a9c3f-9565-4080-a4c7-d475c7e1ed2d	2000415835	Mon Feb 14 2011 07:45:32 GMT-0500 (EST)	KRAKATOWA	9	Listening to 'The Sunday Edition' on CBC radio yesterday, Michael Enright asked his guest,  "When was the last time a military regime handed its power back over to the people?"  The answer:   "Turkey, 1950--since then, NO military has EVER willfully handed power back to the people."  Let's hope to God the Egyptian military keeps its word.
CommentKey:92ca5f77-6b83-4259-8fdb-1848255bbb57	2000415835	Mon Feb 14 2011 07:47:11 GMT-0500 (EST)	TellTheTruth	6	So much for a change.  Dictator dodged the revolution, his military cronies took over, big thieves will continue looting Egypt, poor will remain poor and torture police is untouched.  Washington-tel aviv axis defused democracy and have puppet regime doing their bidding for another 30 years..
CommentKey:1c1b4965-a517-4cb1-8370-f081691fb2b9	2000415835	Mon Feb 14 2011 07:52:56 GMT-0500 (EST)	historyone0one	2	A military secular states is as good as it gets in muslim dominated countries.   Jemaah Islamiyah appears to be similar to Muslim Brotherhood.  Indonesia cleric on 'terror trial'   "In recent weeks, hardliners also have stepped up attacks on Christians and minority sect members.  Despite no significant terror attacks in Indonesia for nearly two years, security in the capital is pervasive, with checkpoints placed at the entrance of all major shopping malls, hotels, embassies and government buildings.  Shadowy movement  The 72-year-old Bashir, is officially the caretaker of an Islamic boarding school on Java island but has long been considered the spiritual leader of the shadowy Jemaah Islamiyah movement, which seeks to establish a Muslim caliphate across Southeast Asia."   Okay, so to prevent "significant" religious attacks there has to be "checkpoints placed at the entrance of all major shopping malls, hotels, embassies and government buildings.   Egyptian liberals should leave well enough alone.
CommentKey:ca6ddce8-a8fc-41dd-a597-6bc077f94311	2000415835	Mon Feb 14 2011 07:53:14 GMT-0500 (EST)	DarrylGerrow	3	"Cairo square protesters told to leave "  I believe the words the military is looking for are:  "You don't have to go home, but you can't stay here."
CommentKey:30ebb63d-5724-48f6-9340-5deb75cefd89	2000415835	Mon Feb 14 2011 07:58:47 GMT-0500 (EST)	TellTheTruth	6	military rulers dissolved the country's parliament and suspended the constitution — two key demands of some of the protesters ========= CBC, bad joke? Those 2 were replaced by military junta. Nothing was met, absolutely nothing.  Emergency law... in effect. Military kangaroo courts... in place. Political prisoners... locked up. Torture ministry... untouched. Int'l obligations (aka looting and abandoning Palestinians)... no change. State tv... in hands of dictators. Opposition... brushed off. People... ignored.  Blood shed for nothing. This is what I call Obama-revolution... from 1 dictator to group of dictators.
CommentKey:44b04db1-d094-407a-9526-a2ea1f32ea5b	2000415835	Mon Feb 14 2011 08:01:33 GMT-0500 (EST)	Brown12	4	First of all I think it's great that they have got Mubarak to resign and are now pointed toward democratic government.  Now they need to stop these juveniles who care more about being protesters than what they are protesting.  If these kids are given too much influence the path to democracy will be in   jeopardy.
CommentKey:219450a3-7b62-4dd8-bc0b-a11aa5b57dfe	2000415835	Mon Feb 14 2011 08:06:24 GMT-0500 (EST)	newbrunswick	0	it prove 40% are not canadian that all they need to be registered first
CommentKey:90353f14-848e-4ff9-b870-f71687e78a70	2000415835	Mon Feb 14 2011 08:07:57 GMT-0500 (EST)	pdhlondon	4	So...parliament has been dissolved...the constitution has been suspended...union meetings and public protests have been banned...a military council is in control of the country and elections will (might) be held in about six months.  Tell me...whose definition of democracy are they using in Egypt these days?
CommentKey:8c5acc31-5c15-40eb-9ccc-5acd56a0a4e3	2000415835	Mon Feb 14 2011 08:13:31 GMT-0500 (EST)	Alex Vega	1	What a bunch of suckers! No-wonder they have lived beneath a dictator all their lives. Looks like it will continue as well. I bet a certain google employee who likes to wail on camera is going to be looking for asylum in the west.
CommentKey:0287d386-44dd-439a-8849-2be50dd58b79	2000415835	Mon Feb 14 2011 08:15:05 GMT-0500 (EST)	J-Practical	5	@Your Mothers Britches  "What pipe dream have you been living? nearly 40% of the Canadian electorate didn't vote last Federal election!"  Perhaps instead of you mother's britches, you should be considering your mother's civics textbooks.  The democratic process works just fine in Canada. The abrogation of voting responsibilities is definitely an issue, but doesn't change the fact that our democratic processes work just fine. Elections are conducted regularly and legally, and produce smooth changes in government.
CommentKey:0ad223c6-eb65-4904-82ca-aa11029c6d39	2000415835	Mon Feb 14 2011 08:15:07 GMT-0500 (EST)	jeff12	3	seems to me that this is now the people's square and they are being "TOLD" to leave by the military?  if they want to stay let them stay, their victory was earned by blood...
CommentKey:4fa037d7-0d34-4e84-91c6-3e585e3b354e	2000415835	Mon Feb 14 2011 08:15:55 GMT-0500 (EST)	TellTheTruth	3	"Middle East peace envoy Tony Blair said the West should remain sensible and be neither complacent nor "hysterical" about Egypt's Muslim Brotherhood." ========= So much sarcasm in 1 sentence:  1.War criminal, butcher of Iraq, 'peace envoy'. 2.Where was he during Gaza massacre? 3.Where was he during Mavi Marmara massacre? 4.@ MB...'neither complacent nor "hysterical"' what in the world does that mean?  MB is one of players in Egypt uprising. It is the largest, best organized, most popular opposition party which was banned by the dictator.  What kind of democracy do leaders of democracy achieve without MB? Tel Aviv, Washington democracy, Blair or Obama type?  Just like in Honduras... ... or occupied Palestine where  -first Bush ORDERED elections,  -US State Department paid for it,  -Jimmy Carter monitored it and  -when (horror) wrong guys won, fair and square,  -results were effectively nullified by demonizing Hamas - puppet Abbas was propped up -he dissolved elected government,  -installed his cronies instead and  -continues in the office even though his mandate expired 2 years ago.   Hypocrisy, stage 2.
CommentKey:76200316-47ac-458a-ad52-5d709256c152	2000415835	Mon Feb 14 2011 08:16:00 GMT-0500 (EST)	jeff12	0	seems to me that this is now the people's square and they are being "TOLD" to leave by the military?  if they want to stay let them stay, their victory was earned by blood...
CommentKey:d66a0abb-bda1-45a4-a8bc-77064f55da3f	2000415835	Mon Feb 14 2011 08:18:56 GMT-0500 (EST)	hchalice	4	Obama Harper wrote: Posted 2011/02/14 at 5:31 AM ET  "Canada wake up and remove Harper"  =========================================  Egypt is struggling to establish a democracy where their infrastructure and economy is in ruins and where systemic corruption is a way of life (bribes are necessary to get just about anything done)...  .... and we have ambulance chasers on these posts that juxtapose Canada's circumstances with theirs.   Whatever Canada's shortcomings (.... and yes... we all know they are there), they are paper cuts compared to Egypt's gaping wounds. The rest of the world is in the amphitheatre watching this operation with anticipation and apprehension.... and hoping that their wounds will heal and that a healthy body politic will emerge that will nourish all of its parts.  In the meantime... put an adhesive bandage on it... :-)
CommentKey:23c2798a-412f-43e1-b66b-c4356bb40cb2	2000415835	Mon Feb 14 2011 08:19:38 GMT-0500 (EST)	hchalice	4	Obama Harper wrote: Posted 2011/02/14 at 5:31 AM ET  "Canada wake up and remove Harper"  =========================================  Egypt is struggling to establish a democracy where their infrastructure and economy is in ruins and where systemic corruption is a way of life (bribes are necessary to get just about anything done)...  .... and we have ambulance chasers on these posts that juxtapose Canada's circumstances with theirs.   Whatever Canada's shortcomings (.... and yes... we all know they are there), they are paper cuts compared to Egypt's gaping wounds. The rest of the world is in the amphitheatre watching this operation with anticipation and apprehension.... and hoping that their wounds will heal and that a healthy body politic will emerge that will nourish all of its parts.  In the meantime... put an adhesive bandage on it... :-)
CommentKey:c57665b9-0c37-4ada-87fb-e278c2f1c05c	2000415835	Mon Feb 14 2011 08:20:16 GMT-0500 (EST)	hchalice	2	Obama Harper wrote: Posted 2011/02/14 at 5:31 AM ET  "Canada wake up and remove Harper"  =========================================  Egypt is struggling to establish a democracy where their infrastructure and economy is in ruins and where systemic corruption is a way of life (bribes are necessary to get just about anything done)...  .... and we have ambulance chasers on these posts that juxtapose Canada's circumstances with theirs.   Whatever Canada's shortcomings (.... and yes... we all know they are there), they are paper cuts compared to Egypt's gaping wounds. The rest of the world is in the amphitheatre watching this operation with anticipation and apprehension.... and hoping that their wounds will heal and that a healthy body politic will emerge that will nourish all of its parts.  In the meantime... put an adhesive bandage on it... :-)
CommentKey:e13781f9-16b6-4d1a-b14e-40996d4d66af	2000415835	Mon Feb 14 2011 08:22:06 GMT-0500 (EST)	hchalice	3	Obama Harper wrote: Posted 2011/02/14 at 5:31 AM ET  "Canada wake up and remove Harper"  =========================================  Egypt is struggling to establish a democracy where their infrastructure and economy is in ruins and where systemic corruption is a way of life (bribes are necessary to get just about anything done)...  .... and we have ambulance chasers on these posts that juxtapose Canada's circumstances with theirs.   Whatever Canada's shortcomings (.... and yes... we all know they are there), they are paper cuts compared to Egypt's gaping wounds. The rest of the world is in the amphitheatre watching this operation with anticipation and apprehension.... and hoping that their wounds will heal and that a healthy body politic will emerge that will nourish all of its parts.  In the meantime... put an adhesive bandage on it... :-)
CommentKey:4fb8e98d-1013-4707-a568-57662edf66e3	2000415835	Mon Feb 14 2011 08:23:41 GMT-0500 (EST)	Alex Vega	3	3 weeks of irritating news on a tin-pot dictatorship. That is still a dictatorship. Way to go!!! The western media helped you achieve nothing. It was a bit of a distraction for Julian, he was supposed to be hogging the headlines.
CommentKey:e77390d1-c97b-49ef-989c-a9b27fb97c94	2000415835	Mon Feb 14 2011 08:23:49 GMT-0500 (EST)	metaphysical grafitti	4	.... Its time for you to go home now... Quit sniffin that smoking gun ....
CommentKey:08196085-f06b-41b7-9609-f6aca73c4565	2000415835	Mon Feb 14 2011 08:24:21 GMT-0500 (EST)	Alex Vega	1	3 weeks of irritating news on a tin-pot dictatorship. That is still a dictatorship. Way to go!!! The western media helped you achieve nothing. It was a bit of a distraction for Julian, he was supposed to be hogging the headlines.
CommentKey:29478e9e-37b6-40c3-a1b7-a51dee73d608	2000415835	Mon Feb 14 2011 08:24:47 GMT-0500 (EST)	userboy	1	Chantable wrote:  "The number of people who vote has nothing to do with the fact that we change our leaders through elections. Perhaps you could explain how you think we change leaders."  Well, proportional representation would be a step in the right direction!
CommentKey:cfe18708-0086-4338-a432-161f0ed3e9d3	2000415835	Mon Feb 14 2011 08:26:51 GMT-0500 (EST)	hchalice	7	Obama Harper wrote: Posted 2011/02/14 at 5:31 AM ET  "Canada wake up and remove Harper"  =========================================  Egypt is struggling to establish a democracy while their infrastructure and economy is in ruins and where systemic corruption is a way of life (bribes are necessary to get just about anything done)...  .... and we have "wailing Jeremiah's" on these posts that juxtapose Canada's circumstances with theirs.   Whatever Canada's shortcomings (.... and yes... we all know they are there), they are paper cuts compared to Egypt's gaping wounds. The rest of the world is in the amphitheatre watching this operation with anticipation and apprehension.... and hoping that their wounds will heal and that a healthy body politic will emerge that will nourish all of its parts.  In the meantime... put an adhesive bandage on it... :-)
