Comment ID	Article ID	Date	Name	Recommendation Count	BodyCommentKey:818901d3-6a85-4ac3-a1ce-ec30b50fe783	2000415568	Sat Feb 12 2011 01:03:13 GMT-0500 (EST)	GaryNelson	9	"Buford Wilson wrote:Posted 2011/02/11 at 10:49 PM ETWho do you think will follow Mike as Liberal leader?  AGREE. Bob Rae DISAGREE. Justin Trudeau ************************************** That's a dumb poll as the next liberal leader is scheduled to come from Lower Canada. The liberals take turns between Ontario and Quebec, omitting the rest of Canada."CommentKey:c659c7f4-1917-4776-9155-39415eac78c4	2000415568	Sat Feb 12 2011 01:03:29 GMT-0500 (EST)	JohnLuft	8	"voxdepopuli says ""If you're so confident of winning the election call one.""  Hey.....all the Libs and socialists have to do is bring the government down.  But they don't have the guts, do they, Comrade?  I mean didn't Ignatieff put the Conservatives on double secret probation....more than once?  You are blowing smoke, Tovarich."CommentKey:03753d28-7a13-4b6b-8721-f04109a01bce	2000415568	Sat Feb 12 2011 01:05:12 GMT-0500 (EST)	awdmother	3	"@DazzlinDino  Von Finckenstein said he learned about Clement's tweet in the newspaper Thursday morning, and that he'd had no contact with the government since the initial announcement of the CRTC's ruling.  ""I don't agree with the government,"" he said. ""The vast majority of internet users should not be forced to subsidize heavy users.""  CBC Feb 3rd    Read more: http://www.cbc.ca/canada/story/2011/02/03/crtc-committee.html#ixzz1DinjalO9nDino"CommentKey:1b2f0eb3-c63f-4852-a2f9-3476d6d94b05	2000415568	Sat Feb 12 2011 01:08:19 GMT-0500 (EST)	Hotter	13	"Bye, Bye Iggy your done now. First Martin then Dion now Iggy. Line em up who's next? Rae I hope Mr. Harper will make short work of that lefty. Please then that useless Goodall after that. Bring em on."CommentKey:b6ebdc47-c0cf-4660-85df-8948b7555244	2000415568	Sat Feb 12 2011 01:10:34 GMT-0500 (EST)	Vancouver921	10	bring on the coalition - spare Canada from a fate worse than Mubarak.CommentKey:b1254509-29b7-483e-8743-0e478c9a77ce	2000415568	Sat Feb 12 2011 01:13:33 GMT-0500 (EST)	Stone Cold	10	"voxdipopuli wrote: - as for ethanol -you give the impression that feeding gas tanks is more important than people. Your policies on global warming and reduced carbon footprint have isolated Canada from the west of the planet. To answer your question if you reserve corn for conversion to ethanol instead of offering it for food, YES you are in part for food shortages. If you're so confident of winning the election call one --------------------------  In true Liberal fashion, you are talking out of both sides of your mouth here.  On the one hand, you claim the government is doing nothing about trying to reduce carbon emmissions.  Then you are critical of ethanol, which will reduce carbon emmissions, because it takes corn out of the food supply.  You can't have it both ways.  As far as the aircraft goes: $30 billion over the lifespan? Where are your numbers coming from rabble.ca? The 65 jets are going to cost 9 billion with a 7 billion contract to maintain them. And I suggest you reread my post. I NEVER said the Liberal investment in the development of the new fighter committed Canada to buy them. YOU claimed no competion took place. I pointed out there was in fact a competition and the F-35 won.  Now the arena:  So, one backbench MP saying something means it is Conservative party policy? You're going to have to do better than that.  Oh, and Copps Coliseum in Hamilton was built when the Liberals were in power in Ottawa."CommentKey:75a587b1-e237-4160-8e1d-0bfb95d8a13d	2000415568	Sat Feb 12 2011 01:15:59 GMT-0500 (EST)	Stone Cold	20	"widman wrote:Posted 2011/02/12 at 12:57 AM ETWithout even looking I can bet there are all sorts of pro-Con supporters here saying 37% means an imminent Majority, and thus, yet again, demonstrating the CON math deficiency! ---------------------  Will 37.3% get him a majority? No.  But he is moving close to it.  In case you forgot, your hero Jean Chretien won a majority in 1997 with just 38.5% of the vote."CommentKey:fe658207-af84-4fb9-bf16-b5bb354857e0	2000415568	Sat Feb 12 2011 01:19:38 GMT-0500 (EST)	RomeoCostello	8	"Why is anyone against Harper a lefty?  I'm a centrist. Most Canadians (2/3rds by the look of things) do not support the Conservatives. That makes them reasonable, not lefty.  Take your paid Con CON about lefties outside and pound it."CommentKey:db6b8c42-c4dc-471c-a14f-7e01e9f62a89	2000415568	Sat Feb 12 2011 01:22:00 GMT-0500 (EST)	Con Crusader	10	"RomeoCostello - ""It's a shame that 37% of Canadians are blinded by false advertising Action Scam signs etc.""  It's actually a very effective use of tax dollars to get our message out. We didn't even need a platform because a few strategic attack ads helped define two Liberal leaders in a row and buy favorable media coverage on the campaign trail. Every time Liberals open their mouths we record new clips to use against them. Conservatives keep quiet so the technique can't backfire. Informing Canadians that the opposition leader is an ineffective flipper-flopper is an important part of maintaining government power. Ignatieff can't recover from this."CommentKey:9ac3a7de-e00f-496c-9bc3-6e9a25390dfd	2000415568	Sat Feb 12 2011 01:22:17 GMT-0500 (EST)	MaryClarke	15	"It's so nice to think that we may be taking back our Country from the weak kneed Liberals and their social engineering,-their stooping down to every Immigrant demand,their cowering to the U.N just so we may appear to ""look nice"",their demands that Canadian kow tow to everyone on our doorsteps while forgetting about Canadians themselves. A Party that has done whatever they could,to villafy their own Soldiers,and even accuse them of War crimes. To stand up on the World stage and publically proclaim that OUR Country does not deserve a seat on the U.N Securuty Council. To run off to the UAE in an attempt to discredit their own Country\s position??? Who the h^ll are these traitors to Canada??? The Liberal Party is who they are. So bitter about their loss of entitement that they'll stoop to any low in their quest for power. _Even if it meands running down and betraying their OWN Country. Despicable and sad."CommentKey:54b5a0ed-1326-442c-9056-b16564877a4e	2000415568	Sat Feb 12 2011 01:24:50 GMT-0500 (EST)	saskatchewinner	12	"Smell that???  that smell is the smell of a Conservative Majority Government!  coincidentally, it smells an awful lot like the crap that is being scared out of the liberal machine."CommentKey:8339fc7b-6f8f-4328-b312-b39aa7a4dcbd	2000415568	Sat Feb 12 2011 01:25:45 GMT-0500 (EST)	PeterDN	11	"widman wrote:Posted 2011/02/12 at 12:57 AM ET ""Without even looking I can bet there are all sorts of pro-Con supporters here saying 37% means an imminent Majority, and thus, yet again, demonstrating the CON math deficiency! ... An election today would yield the same result, ..."" ---------------------------------  So, if 37% is not approaching majority territory, what, in your most humble and perfect opinion is ""majority"" territory ... for the CONs, I mean as I am sure that number will have to be higher than for the Liberals, of course. So, what is the magic number for CONs, 51% or higher, 98% or higher?  Posted 1:26 AM ET"CommentKey:c1d03230-4cd8-4da4-a78b-867aa77239cf	2000415568	Sat Feb 12 2011 01:26:04 GMT-0500 (EST)	GaryNelson	16	"Stone Cold wrote:Posted 2011/02/12 at 1:15 AM ETwidman wrote:Posted 2011/02/12  at 12:57 AM ETWithout even looking I can bet there are all sorts of pro-Con supporters here saying 37% means an imminent Majority, and thus, yet again, demonstrating the CON math deficiency!  ---------------------   Will 37.3% get him a majority? No.   But he is moving close to it.   In case you forgot, your hero Jean Chretien won a majority in 1997 with just 38.5% of the vote. ********************************** Haha,.,,,, widman hasn't forgotten but by his post he definitely hopes everybody else has.  A well earned con majority is in the works!"CommentKey:637dfef1-18c4-4775-90b6-7d5aac6478a1	2000415568	Sat Feb 12 2011 01:26:41 GMT-0500 (EST)	RomeoCostello	8	"saskatchewinner wrote: ""Smell that??? it smells an awful lot like the crap""  Amen.  The crap has got to be flushed."CommentKey:0bb9bbf8-a250-4ec8-bb68-815ccac73bb4	2000415568	Sat Feb 12 2011 01:27:43 GMT-0500 (EST)	RomeoCostello	7	"Con Crusader wrote: ""It's actually a very effective use of tax dollars to get our message out.""  Stop using my money to advertise your crap!"CommentKey:b733a62f-7e8c-44b5-b9c4-8839bda66e7d	2000415568	Sat Feb 12 2011 01:28:42 GMT-0500 (EST)	Cubical Escapee	9	In other news the collective intelligence of Canadians reaches new lows.CommentKey:e2a0cb09-633c-4546-b2b9-c3e51c013732	2000415568	Sat Feb 12 2011 01:31:18 GMT-0500 (EST)	cookiecrumble	8	I threw up in my mouth.....sorry steve..CommentKey:354243b8-3ced-49d2-875d-8b52f427bfe2	2000415568	Sat Feb 12 2011 01:33:42 GMT-0500 (EST)	PeterDN	9	"widman wrote:Posted 2011/02/12 at 12:57 AM ET ""Without even looking I can bet there are all sorts of pro-Con supporters here saying 37% means an imminent Majority, and thus, yet again, demonstrating the CON math deficiency! ... An election today would yield the same result, ..."" ---------------------------------  So, if 37% is not approaching majority territory, what, in your most humble and perfect opinion is ""majority"" territory ... for the CONs, I mean as I am sure that number will have to be higher than for the Liberals, of course. So, what is the magic number for CONs, 51% or higher, 98% or higher?  Posted 1:26 AM ET"CommentKey:78acb012-1088-4799-b5c0-2530731c63d6	2000415568	Sat Feb 12 2011 01:35:06 GMT-0500 (EST)	saskatchewinner	10	"Aulden Gray wrote: God help our country.   Aulden:  While I would not call PM Harper a God, I do agree with you he has helped our country, and will continue to do so.  but you CAN thank the Liberal Elite and their incredibly poor decisions, for us NOT having a Liberal Government now, or in the foreseeable future."CommentKey:cf6e09f2-3fc0-404f-a6e0-157df57859fb	2000415568	Sat Feb 12 2011 01:35:16 GMT-0500 (EST)	Stone Cold	13	"widman wrote:Posted 2011/02/12 at 12:57 AM   He has to have one before Kevin Page gets his numbers out, before the Afghan detainee issue gets exposed, and before someone like Wiki Leaks starts letting us know what is really going on behind closed doors in Ottawa! -------------------------  What numbers from Kevin Page? Regarding the G8/G20 costs? In case you missed it, he reported MONTHS ago that his preliminary review showed nothing out of the ordinary.  They only thing he pointed to was the government ""probably"" could have saved some money using the military instead of paying the RCMP overtime.  As far as the detainee issue is concerned: Aren't your arms tired from beating that dead horse? The majority of Canadians DON""T GIVE A CRAP.  A committee of Lib, Bloc, and CPC MP's have been reviewing both the redacted and UNREDACTED documents pertaining to this subject for what, 7 months now? Not a SINGLE document has been found worthy of being publicly released."CommentKey:0d41a8e1-8771-4e9e-b5da-613195f155d5	2000415568	Sat Feb 12 2011 01:35:18 GMT-0500 (EST)	Fableman	8	Is it just me guys or from afar doesn't the green party symbol look like the BP oil symbolCommentKey:3c8cd4f0-b9a6-492e-8914-6ae45849eddd	2000415568	Sat Feb 12 2011 01:40:45 GMT-0500 (EST)	saskatchewinner	10	"man4change wrote:Posted  Canada needs a Liberal majority government. I can't believe that after all the scandals, lies, backroom agendas and deception how anyone would consider re-electing this backward regime. I am optimistic that voters will come around and defeat the Tories before what's left of Canada disappears. Ekos is known for its pro-conservative slant. =====   Hey everybody, meet the New kid....   He doesn't understand how things are done around here, so lets take it easy on him for a bit.  but here is a little hint to help you:  EKOS is a Liberal Party Company"CommentKey:c52f6bc7-ae9a-4965-9b48-ad3ab746331d	2000415568	Sat Feb 12 2011 01:42:15 GMT-0500 (EST)	TerryWiens	6	"@CommonersSay ""This Conservative gov't may not be all things to all people but Canadians are realizing that they provide competent and scandal free governing""  Are you reading the same news I am?  I would list the scandals but I'm limited to 1600 characters but think Afgan torture, suppressing information, muffling the diplomatic corp, proroguing government, leaving secret documents at your girlfriends, creating the largest government to date, appointing senators, running the highest deficit in our history, muffling government scientists, should I go one.  And if you define competence as denigrating anyone who doesn't agree with you, constantly attempting to disgrace Commissioner you have appointed but didn't succumb to the pressures of the ruling party, an Integritg Commissioner who refuse to show up when subpeoned, sticking to a script rather than actually answer a question and manipulating government ads to look like Conservative ads using tax dollars.  Is this really your idea of a competent and scandal free government?"CommentKey:e490a748-3fe8-4ebb-bf15-fd3bcf17b85f	2000415568	Sat Feb 12 2011 01:44:15 GMT-0500 (EST)	PeterDN	11	"RomeoCostello wrote: Posted 2011/02/12 at 1:27 AM ET ""Con Crusader wrote: ""It's actually a very effective use of tax dollars to get our message out.""  Stop using my money to advertise your crap!"" ---------------------------  Sure, we'll do that as soon as the Liberals stop using the Conservative tax payer dollars to advertise their crap out through the CBC, the Liberal shill media network.  Posted 1:43 AM ET"CommentKey:8e25493d-1532-41ea-a855-9cbe1ca4b19b	2000415568	Sat Feb 12 2011 01:46:00 GMT-0500 (EST)	Tdrouillard49	9	"This poll was conducted 2 weeks ago.....let's just wait and see what the next one shows. I am always suspicious of these polls, not that they probably aren't accurate, but how are the questions coached and are they asking the same people in the same region time after time. If and when an election does come down to the electorate....I have a very simple solution.... If there is a debate between candidates open to the public and one or more decline to appear.....then DON'T VOTE THEM IN."CommentKey:eacadb4a-62bc-4755-a5fe-771edc081b03	2000415568	Sat Feb 12 2011 01:48:04 GMT-0500 (EST)	Fableman	9	The Conservatives are the Moral opposition to what is wrong in Canada they are very pro economy and pro life very positive government I have found they still have my vote. They have enough guts to take on the EU they can spend on a real military to defend us We produce the world's most oil they will in fact look at enviromental issues and they care about the everyday CanadianCommentKey:16a51bd5-0a38-4981-aaa7-5db504fb7aa4	2000415568	Sat Feb 12 2011 01:48:36 GMT-0500 (EST)	andy cynic	17	"Its time Iggy to start writing his autobiography, at Harvard."CommentKey:2eb3259e-f5b1-464f-ae8b-6209c69a3bcf	2000415568	Sat Feb 12 2011 01:51:03 GMT-0500 (EST)	Capt_Canada	7	Even Harper himself stated that he doesn't believe these numbers.CommentKey:ffb2a747-6367-4bf9-9767-4240838920a1	2000415568	Sat Feb 12 2011 01:51:59 GMT-0500 (EST)	Grandma47	8	"As written in another post today:  ""Harper seems to be using his Christianity as a hypocritical façade.  The constant and continual lying, coercion, cheating and corruption by him and his government demonstrate that he is kicking his own precious ""ten commandments"" in the face - call yourself a Christian and hoodwink the gullible voters.""  And, his pro-Israel stance is so hypocritical.  You can see him wince through his plastic smile because he wants the Jewish vote."CommentKey:9787b8d8-8e56-48b0-bbe2-ca2763bc1efd	2000415568	Sat Feb 12 2011 01:55:18 GMT-0500 (EST)	JHHawthorn	6	"Joannie04 wrote: JHHawthorn : Are you serious??? Vote for the NDP??? You really want to have corporations taxed to the hilt, close shop in Canada, move overseas and layoff Canadian workers??? There's a reason why Iggy is keeping rather silent on the corporate tax thing... he knows that not all corporations are the stereotyped corporate fat cats. Most corporations in Canada are small to medium sized companies which are the backbone of the Canadian economy. Heck, even my dentist is a ""corporation"".    The power of collecting and disbursing money at pleasure is the most dangerous power that can be entrusted to man, particularly under our system of collecting revenue by a tariff, which reaches every person in the country, no matter how poor he may be, and the poorer he is the more he pays in proportion to his means. What is worse, it presses upon him without his knowledge where the weight centers, for there is not a person in Canada who can ever guess how much he pays to the government.  So you see, that while you are contributing to relieve one, you are drawing it from thousands who are even worse off than he."CommentKey:060c5009-6d64-49f0-81ae-050f7bf5b7f9	2000415568	Sat Feb 12 2011 02:00:37 GMT-0500 (EST)	bgGruff	7	the Harper tragedy..a majority mandate..nobody to blame..no economic  plan to copy..Harper has repeating nightmare..a whole field of snow..with no tracks to follow..CommentKey:6448476c-1217-41ea-8cdd-82d9820c949c	2000415568	Sat Feb 12 2011 02:01:03 GMT-0500 (EST)	oldgreg	6	"Pre-Election Budget Sabre Rattling Masks Stagnant Party Vote Strength  Conservatives (34%), Liberals (29%)  Friday, February 04, 2011  http://www.ipsos-na.com/news-polls/pressrelease.aspx?id=5125"CommentKey:efc41710-0b9a-403c-b40c-bb43e63eaff5	2000415568	Sat Feb 12 2011 02:06:11 GMT-0500 (EST)	JustAnAverageGuy	9	"RomeoCostello wrote:Posted 2011/02/12 at 1:19 AM ETWhy is anyone against Harper a lefty?  I'm a centrist. Most Canadians (2/3rds by the look of things) do not support the Conservatives. That makes them reasonable, not lefty.  Take your paid Con CON about lefties outside and pound it.""  >>>>  If you were a true ""centrist"" you would know the answer to that question. I too consider myself to be a centrist. I am not ""pro"" Harper but I am currently anti the legitimate alternatives (Lib, NDP or a coalition). Harper obviously is to the right of center so it only stands to reason that his  strongest supporters would consider those who vehemently oppose him ""lefties"". Centrism is a rather fleeting ideal which can be interpreted much differently among its proponents and it can change from issue to issue. To those strongly on the ""right"" centrism would appear to be leftist while to those strongly on the left it would appear to be ""rightist"". It has been stated that most Canadians are centrists. I tend to agree with that statement. What bothers me is when people who claim to be ""centrist"" imply that all centrists share a common goal, ideal and/or philosophy. That just isn't the case. There are right leaning centrists and left leaning centrists, each with their own ideals and each have no particular loyalty to any of the main stream parties, but rather their own ideals.  When it comes time to vote they will vote for the party/candidate they feel closest resembles their ideals and/or who they trust the most For the time being at least, it would seem the Conservatives are winning that contest."CommentKey:381fe42e-0bc7-4a73-8055-16a0501bfac1	2000415568	Sat Feb 12 2011 02:08:58 GMT-0500 (EST)	Con Crusader	6	"Tdrouillard49 - ""This poll was conducted 2 weeks ago.....let's just wait and see what the next one shows.""  It will show 40+% because most people make up their mind from these poll results and not from the ridiculous posts buried 400 deep in a blog. It's very much a case of the tail wagging the dog, or positive feedback if you like. Most people don't even know or care about the scandals and will base their vote on media polls. Everyone wants to vote for the winner, and that means more Conservative support. All we need to do is stay quiet, run attack ads, and let the Liberals keep picking the wrong issues to champion."CommentKey:edb80bbb-7953-4b56-bcfd-f58029aa3ad2	2000415568	Sat Feb 12 2011 02:10:08 GMT-0500 (EST)	thornz	7	Wow looks like a solide 30% majority LOL.CommentKey:ac2efad7-a0e5-481c-877c-333265f43890	2000415568	Sat Feb 12 2011 02:13:47 GMT-0500 (EST)	thornz	8	"If these poles were at all accurate we would not have been seeing propaganda for the last year about what a great job herper is doing and how we should be afraid to ""change course"". Ssssssssniffffffffffffff sniiiffffffffffffffffff........ aaaaaaaaaaaaahhhhhhhhhhhh......... ffffffffear."CommentKey:6dfb0d78-35d9-4861-b093-6c92069f8ec0	2000415568	Sat Feb 12 2011 02:14:55 GMT-0500 (EST)	AlexN13	10	"More hood winking here I imagine.  All over the blog-o-sphere I hear rumblings of discontent over the litany of fumbled harperion covert actions. Selling out the border, selling off the stock exchange, The CRTC boon-doggle   Everywhere I go  the usual  "" Harper as the stable choice"" rhetoric suddenly silent, and you tell me they have jumped 12.5 points.    Something ain't kosher here."CommentKey:a1c7a493-af24-435a-bf3d-af9c561552aa	2000415568	Sat Feb 12 2011 02:16:39 GMT-0500 (EST)	VideoNick56	8	"Ragtime wrote:   ""The lefties interpretation of this will be priceless! Bring it on I need some high level stimulation. You know from the intellectuals.""   Well played! You've managed to work in TWO Tea Party-worthy pejoratives ('lefties'  'intellectuals' ) in one short post!  (Really, what is this obsession with 'intellectuals'?!  What is it about intelligence that some people find so frightening that they have to attack it at every opportunity?  Interesting...)"CommentKey:759028a6-57bb-4395-a9ff-04b25439eb97	2000415568	Sat Feb 12 2011 02:17:59 GMT-0500 (EST)	MaryClarke	13	"Liberal support, the survey suggests, is lower than the result in the 2008 federal election — the party's worst-ever showing at the polls|  People are finally waking up!"CommentKey:bce77f69-1b2b-4411-b064-735235a9035d	2000415568	Sat Feb 12 2011 02:18:17 GMT-0500 (EST)	VeryPointy	13	"People may not like Harper, but they sure don't like Iggy. The more Iggy speaks in public, the worst his public approval rating becomes."CommentKey:48adda71-9d52-438b-84cb-5c3beb4c6d14	2000415568	Sat Feb 12 2011 02:18:43 GMT-0500 (EST)	bobbozhang	7	When will the people of Canada follow the example of the Egyptians and demand a true democracy?CommentKey:934420a1-f683-4303-9bdd-6981b4508c85	2000415568	Sat Feb 12 2011 02:18:58 GMT-0500 (EST)	buddhawest	8	"Fableman writes: ""The Conservatives are the Moral opposition to what is wrong in Canada "" ------------------------------------ And with that you validate your moniker."CommentKey:3d1cc709-c4dc-4f4b-8cae-4665b5166a1d	2000415568	Sat Feb 12 2011 02:21:08 GMT-0500 (EST)	JHHawthorn	3	"If government has the right to give to one, they have the right to give to all; and, as the Constitution neither defines charity nor stipulates the amount, they are at liberty to give to any and everything which they may believe, or profess to believe, is a charity, and to any amount they may think proper. they will very easily perceive what a wide door this would open for fraud and corruption and favoritism, on the one hand, and for robbing the people on the other.  The people have delegated to House of Commons, by the Constitution, the power to do certain things. To do these, it is authorized to collect and pay moneys, and for nothing else. Everything beyond this is usurpation, and a violation of the Constitution.'It is a precedent fraught with danger to the country, for when mps and senators once begin to stretch its power beyond the limits of the Constitution, there is no limit to it, and no security for the people.Money with them is nothing but trash when it is to come out of the people. But it is the one great thing for which most of them are striving, and many of them sacrifice honor, integrity, and justice to obtain it.""   We may submit to the tyrant who usurps our government, but we will not yield to the robber who filches our purse."CommentKey:3770e4d3-ef15-42b1-86f1-9b8955f8e3a6	2000415568	Sat Feb 12 2011 02:23:48 GMT-0500 (EST)	DrTwitch	16	"widman posted: ""Without even looking I can bet there are all sorts of pro-Con supporters here saying 37% means an imminent Majority, and thus, yet again, demonstrating the CON math deficiency! I also note the ""undecideds"" have grown nearly 1%. Nearly 16% undecided, enough to totally change the outcome, and most unlikely, this deep in a mandate, to vote status quo. And once again, as every poll in the past five years has demonstrated, the overwhelming Majority of Canadians are not behind the current regime and will not be voting for them. An election today would yield the same result, only this time the opposition will be prepared, and will present the GG with a plan for governing that represents the Majority.""  This demonstrates your math deficiency.  Because 37.3 is a much bigger number than 24.8 and again a much bigger number than 14.2.  So what is demonstrates is that poll after poll shows that the Conservatives are the most popular party in Canada.  And your fabled coalition. Answer me this, widman. If the coalition will lead to your promised land, why wait for an election?  Why doesn't Ignatieff form one now and go the the GG?"