Comment ID	Article ID	Date	Name	Recommendation Count	BodyCommentKey:4a6b9202-5de1-417e-b26e-1b241082869c	2000415568	Sat Feb 12 2011 11:45:27 GMT-0500 (EST)	S Banks	22	"Who's uneducated ? The polls show many are a lot smarter then the Liberals think.  isn't it amazing that that so many call Harper a Bush and complain he would have got Canada into Iraq ? So are they suggesting that Igantieff is some kind of alternative? They complain Harper has no compassion.  Lets take a close look at Ignatieff, pro Iraq.  Republican Iggy Bush.  ""To defeat evil, we may have to traffic in evils: indefinite detention of suspects, coercive interrogations, targeted assassinations, even pre-emptive war."" (New York Times Magazine, May 2004 Igantieff  His lack of understanding and compassion for Quebec.  “Quebeckers walk around with this fantasy of how different they are, but they are just North Americans who speak French... They take the minor difference and magnify it.” – Michael Ignatieff, Globe and Mail, April 2, 1998.    Iggy on the poor.  ""I strongly support reductions in food aid. Is that a difficult human rights problem? You bet. But that’s where I would go."" Ignatieff (Harvard, 2005)  Iggy Bush loves the Pentagon and knocks Canada.  “If you are a human rights defender and you want something done to stop  massacre, you have to go to the Pentagon, because no one else is serious,” ........Ignatieff said.” Macleans July 17/09 Martin Patriquin  Iggy accuses our military of torture but supports it himself ?  ""...in a situation of extreme necessity, the possibility, even a slight possibility, that it [torture] may reveal some life saving result would almost certainly overwhelm any consideration that it is evil."" - Michael Ignatieff, The Gifford Lectures, University of Edinburgh, January 2003  Get to know your Liberal leader."CommentKey:cdae9e7a-88fd-4ac9-9410-03c7ce01a08f	2000415568	Sat Feb 12 2011 11:45:50 GMT-0500 (EST)	Eggyoke	8	I don't get it. Have we not vilified Harper and the Cons enough to YOU PEOPLE (we even told you how funny looking he is). You clearly do not have the capacity to make good decisions for yourself so in the next session we will introduce a bill the will  that will relieve you of the responsibility and just remove any other party but ours in an election. Maybe then with only one party on the ballot you will finally see what the best choice isCommentKey:54c72789-bf5c-4bb1-8977-f1f976417fe4	2000415568	Sat Feb 12 2011 11:45:56 GMT-0500 (EST)	David James	17	Grandma47 quips:  “Canadians need to vote strategically so that we can get rid of the tyranny of the Harper Conservatives!”  How tiresome and dated your sentiments are granny.  I’d suggest you clean out the ol’ ear horn and start listening to the news along with the positive comments towards Harper and the CPC.  It just goes to show – not all seniors are wise with good sage advice.CommentKey:167fb7f7-5ff2-4095-ba5d-ee58145b0b32	2000415568	Sat Feb 12 2011 11:46:11 GMT-0500 (EST)	skye60	5	"Well, there are lies, damn lies and then Conservatives. Example. The price of food hasn't increased significantly. Yeah, right. A loaf of bread is 25% smaller, mac'n'cheese has half the pasta it used to have and I bought a tub of spread for my toast the other and noticed when I got home that the bottom was cone shaped and now held 50% less than it used to. Just 3 examples but the price didn't go up, just the quantity went down. Food costs a lot more thusly but it doesn't show on the gov't bean-counters"" books so the ""spin-quacks"" can have their fun and lie like the proverbial cracked sidewalk."CommentKey:cf2ad84f-9caa-4d6a-8478-c13496ad340f	2000415568	Sat Feb 12 2011 11:46:20 GMT-0500 (EST)	IlookIsee	5	"The ""Green"" party is a child of the Con party designed to undercurt the NDP. A very successful political ploy. The process demonstrates a TOTAL lack of ethics and principals but since when have the cons ever had those.   REMEMBER BULLRONNEY!"CommentKey:fdffd31a-53bb-4c8b-bce8-f9f595ae63c3	2000415568	Sat Feb 12 2011 11:47:39 GMT-0500 (EST)	E Camp 49	7	"I've always thought that people should get what they deserve. For instance, the Americans and British fully deserve the financial disaster fostered on them by Blair and Bush.  But Canada is a little different because we never elected this government to a majority. Furthermore, the way Canadians have been manipulated with propaganda via their taxes and through what can only be described as the most self-serving private media in the western world is outrageous.  In Canada's case, I think the elites should be served notice. Their old British mentality of government/elite control of every aspect of citizens lives is over.  Believe me, we don't think you are smart enough to accept that w/o wrecking what is best about Canada.  Stupid in this case, doesn't come close to representing you're nepotism and despotism."CommentKey:dade9061-1049-47ef-930a-4f0a8c76a01a	2000415568	Sat Feb 12 2011 11:50:38 GMT-0500 (EST)	Nforesir	6	Lets hope the polls persuades the libs/ NDP not to bring the gov down forcing an election....and also does not embolden the Con to think they will get a majority.....Can does not need an election!!!CommentKey:75f3916f-518a-46d5-bc37-8dc37ffa62f3	2000415568	Sat Feb 12 2011 11:51:20 GMT-0500 (EST)	Bleak House	9	"We currently have a government that has the support of a minority of Canadians. This government has been introducing damaging and expensive legislature as if they had the approval of the entire Canadian population. Thankfully, we do have an Opposition, but the Senate has been deliberately loaded with Conservatives. When Harper starts to fear that his authority is weakened he prorogues, lies, or hides evidence. Canadians are far too polite. It's time to do an ""Egypt."""CommentKey:33dd63d1-885c-441e-aafc-7a5c12b8f1b9	2000415568	Sat Feb 12 2011 11:52:10 GMT-0500 (EST)	coffee4ever75	17	"Grandma47 wrote ""Canadians need to vote strategically so that we can get rid of the tyranny of the Harper Conservatives!""  Comments like this sicken me. You and all the other crying left wingers out there don't have even a clue what tyranny is. I would just love to see some of you shipped off to a country that experiences true tyranny, just for a day or so. You'd come back with mouths shut, and the rest of us would be happy.  Canadians are so blessed to live in a democracy- not a perfect one of course, as that ideal just doesn't exist- but a fully functioning democracy nonetheless. It's one thing to disagree with a political party, and it's important that there are people who disagree. However, it blows my mind that there is anyone out there dumb enough to equate a democratically elected government who has far more public support than any other political party to a tyranny.  Shame on you for ignorance."CommentKey:4459ccf2-26b5-407d-84c4-732553835de8	2000415568	Sat Feb 12 2011 11:54:53 GMT-0500 (EST)	S Banks	18	"Who's uneducated ? The polls show many are a lot smarter then the Liberals think.  isn't it amazing that that so many call Harper a Bush and complain he would have got Canada into Iraq ? So are they suggesting that Igantieff is some kind of alternative? They complain Harper has no compassion.  Lets take a close look at Ignatieff, pro Iraq.  Republican Iggy Bush.  ""To defeat evil, we may have to traffic in evils: indefinite detention of suspects, coercive interrogations, targeted assassinations, even pre-emptive war."" (New York Times Magazine, May 2004 Igantieff  His lack of understanding and compassion for Quebec.  “Quebeckers walk around with this fantasy of how different they are, but they are just North Americans who speak French... They take the minor difference and magnify it.” – Michael Ignatieff, Globe and Mail, April 2, 1998.    Iggy on the poor.  ""I strongly support reductions in food aid. Is that a difficult human rights problem? You bet. But that’s where I would go."" Ignatieff (Harvard, 2005)  Iggy Bush loves the Pentagon and knocks Canada.  “If you are a human rights defender and you want something done to stop  massacre, you have to go to the Pentagon, because no one else is serious,” ........Ignatieff said.” Macleans July 17/09 Martin Patriquin  Iggy accuses our military of torture but supports it himself ?  ""...in a situation of extreme necessity, the possibility, even a slight possibility, that it [torture] may reveal some life saving result would almost certainly overwhelm any consideration that it is evil."" - Michael Ignatieff, The Gifford Lectures, University of Edinburgh, January 2003  Get to know your Liberal leader."CommentKey:12d8f189-0bb4-41bc-a31d-7fc5d58c92d2	2000415568	Sat Feb 12 2011 11:56:03 GMT-0500 (EST)	skye60	4	"@stfromthewest. Just a minor correction to your comment. The term is ""champing at the bit""...not chomping."CommentKey:b5f71ccb-1361-4c7e-bde8-bcc0a19c8516	2000415568	Sat Feb 12 2011 11:57:28 GMT-0500 (EST)	mel_in_nl	8	I don't understand HOW... The Conservatives have done NOTHING for my part of the country since they got in power...CommentKey:d3f1cb34-05c7-40cd-9e75-433b330ca287	2000415568	Sat Feb 12 2011 11:58:46 GMT-0500 (EST)	redforever	17	"Halcyon Mantra wrote:   ""If this country ever goes to a majority for his crew of thugs, lunatics and illiterates then I will be one of the first to abandon all hope for Canada and abandon the sinking ship.""    I would wager you are yet another Liberal who complains about the negativity of attack ads while making attacks on the other party.   Really, these temper tantrums from the Liberals are wearing thin. What do you hope to accomplish by yelling and name calling?  You are probably stomping your feet and yelling at your computer screen too, right?"CommentKey:da4c9aca-6d57-4018-a7f5-0c464471f8ff	2000415568	Sat Feb 12 2011 12:02:04 GMT-0500 (EST)	Rob in Calgary	20	"Could it be that the Liberal-led false accusations, personal attacks and threats of violence against Conservatives is finally catching up to them in the eyes of Canadians?  The false accusations of War Crimes, the personal attacks of racist and facist, to the threats of a Canadian Revolt against Conservatives are showing how *SOME* Liberals completely lack the basic human integrity and dignity that most Canadians expect from our politicians."CommentKey:d0887a28-b556-426e-b83b-2ed8dcc29af9	2000415568	Sat Feb 12 2011 12:02:36 GMT-0500 (EST)	redforever	15	"trump card wrote:   ""The libs numbers go down every time the chosen one opens his mouth""   True except for one word that you used.   You should substitute appointed for the word chosen."CommentKey:b3114ea5-d770-4a71-bd75-ccf4787f4610	2000415568	Sat Feb 12 2011 12:02:36 GMT-0500 (EST)	David James	18	"NormaWilson believes:  “…If Stephen Harper continues to rule this country we will become more Americanized. Is that what you all want? Do you not love this country? I do. I will never vote the Cons because the name implies the truth, Cons. Harper is the wolf in sheep's clothing.”  Hmmm, there must be, according to your rudimentary logic, a great many Canadians not quite up to standard with your political acumen and intellect.  I’d suggest you reread the latest poll results and try again."CommentKey:636596b7-6162-4229-8360-bcf412366ee5	2000415568	Sat Feb 12 2011 12:05:46 GMT-0500 (EST)	Blind Eye	3	"I hope harper wins his majority and once he's destroyed the country in 4 years Canadians will once again decimate the conservative party of hidden fees (taxes)and spending on jets, corporations and the upper class. Hopefully we'll finally tire of partisan politics and change the system to one that works for Canadians of all walks of life. Not just the upper crust on the fake guise of jobs for all. Politicians are the dinosaurs of the present time."CommentKey:9d68d02a-229d-4c72-bca8-80edb9a98692	2000415568	Sat Feb 12 2011 12:05:52 GMT-0500 (EST)	AlexFinck	14	"Anti-Nihilist wrote:Posted 2011/02/12 at 11:29 AM ETAugustMurphy-King wrote:Posted 2011/02/11  at 6:33 PM ETYoung people absolutely, 100% have to go out and vote this next time around. If everyone eligible to vote under 30 did actually vote, then the Cons wouldn't stand a chance.  ------  I'm 20 live in the Maritimes, not Alberta and I voted for Harper in the last election. Not only that but right now I'd vote Conservative again. Give young people a little bit of credit just because your under 25 doesn't mean your going to vote for the NDP or Liberals. As a matter of fact I for one, have enough of a brain to resent your insinuation that most young people don't pay attention to politics and just vote for whatever left wing party is loudest.   If the NDP and Liberals are counting on young people not paying attention to what they've been doing (or lack there of) or saying (a whole lot of nothing) and need blind votes from the uninformed to win then maybe they shouldn't bother running. But before its mentioned what I'd like to say before someone decides to call me a Conservative shrill  is I don't consider voting for the Liberals or NDP uniformed I consider voting for a party ANY party you know nothing about uninformed and silly. And I consider those who hope that those sort of people show up to vote even more so. After all this is Canada you can have whatever political opinion you want just be able to back it up if someone calls you on it."CommentKey:1e14d874-2092-4575-934c-ba2e0a43d9ab	2000415568	Sat Feb 12 2011 12:08:04 GMT-0500 (EST)	HalcyonMantra	4	"taffy35 writes: ""Stephen harper and his party have done a good job guiding canada through the recession.400,000 thousand jobs created,""  That's good going, taffy - but you seem to be missing the 3 million jobs lost. Wow - I did good today, I resisted eating the cheesecake...but I did eat the cheesecake yesterday, and the ice cream, and the pumpkin pie...I'm all out of good food now but I'll give the bullies whatever I have left cuz I know they'll take care of me - too bad about those neighbours too far away though, I guress they lose."CommentKey:1756a946-c06b-4e0e-a73b-73d1300b5ec8	2000415568	Sat Feb 12 2011 12:08:56 GMT-0500 (EST)	Devon K.	12	"And vice versa would you not agree? I think Harper will emerge as a has been and Iggy as a never was no matter the outcome. Opposition for Iggy or another minority for Harper equals a loss for both! - JasonAllan  Normally I'd say Harper's goose would be pretty cooked if he didn't win a majority this time around but there's a difference with the current Liberal Party and the Conservative Party that  guarantees his job.  The Liberals have several leaders in the wings: Justin Trudeau, Bob Rae, Martha Hall-Findley, among others.  The Tories don't have anyone with real leadership aspirations, national appeal, or the ability to hold the party and movement together.    Simply put the Liberals will be better off without Ignatieff.  Conversely the Tories right now would be doomed without Harper."CommentKey:d47726a1-60d4-401d-bc33-3ea9e703ac46	2000415568	Sat Feb 12 2011 12:09:10 GMT-0500 (EST)	JasonAllan	6	"EKOS polls always show Conservative popularity percentage leads that never materialize in election results. As with politicians promises, EKOS's record dulls their accuracy and believability. Their polls are probably done in right wing areas to produce the results they plan to achieve. The Harper planned election that he will proclaim he didn't want has a ""best case scenario"" of another minority government and another $300 million added to the deficit. The size of the deficit is of no concern to Harper. He wants a majority he will never achieve but may become opposition leader if his illegal maneuvers exposures get out of hand."CommentKey:7ef97852-8f4c-40b2-887b-c4900a3d8dea	2000415568	Sat Feb 12 2011 12:09:44 GMT-0500 (EST)	dgordon	12	"trump card wrote  The libs numbers go down every time the chosen one opens his mouth ---------------------------------------------------------- Iggy is keeping his yap shut more lately, sending outs yap dogs to attack the Cons Holland, McSquinty and Ralph (failed finance mister) Goodale,  All 3 are providing assistance in bringing the Liberals to there knees"CommentKey:ddba3e37-d421-4cd8-9932-1c695558834a	2000415568	Sat Feb 12 2011 12:09:48 GMT-0500 (EST)	David James	10	"PeterDN correctly retorts:  “NormaWilson wrote:Posted 2011/02/12 at 10:53 AM ET   ""I think there should only be two Parties ... If Stephen Harper continues to rule this country we will become more Americanized.""   - If we go to a two party system, then we will be taking a step closer to being ""Americanized"". Is that what you want?   ""Is that what you all want? Do you not love this country? I do. I will never vote the Cons because the name implies the truth, Cons. Harper is the wolf in sheep's clothing.""   - This is Leftie arrogance. You are saying that if anyone votes for the Conservatives, that person hates our country. Can you not see the arrogance in that statement?   I love Canada as it is and that is WHY I vote Conservative, because I think the Conservatives are better for this country at this time than any other party.   For you to suggest I hate Canada because I vote Conservative is arrogance in the extreme.”  Peter, Norma’s naive accusation is entirely the reason why so many Liberal clingers-on are flailing about replete with unfounded and implausible rubbish."CommentKey:601f5e52-58f5-40df-ad69-8e332444c0eb	2000415568	Sat Feb 12 2011 12:09:59 GMT-0500 (EST)	StevenHarp	9	"CommonersSay wrote:Posted 2011/02/11 at 5:29 PM ETThis Conservative gov't may not be all things to all people but Canadians are realizing that they provide competent and scandal free governing; that's a minimum that Canadians expect and had not received from successive Liberal gov'ts. ----------------------------------------------- ""competent and scandal free""  You caught me off guard there. I almost choked. A clear case of denial. Living in a world of poster boy ads must truly have its benefits over dealing with reality.  That type of ignorance is not genuine. It is contrived by back room spin doctors. No one is that dam gullible. Perhaps it is sarcasm or someone with a deep dependence on illegal drugs. Bares repeating ""competent and scandal free"" . I can hardly imagine anyone of sound mind describing the CRAP coalition using those terms. Perhaps Mercer in a comedy sketch which would be sure to get resounding laughter.  A challenge: All those who can think of credible reports of ""competent and scandal free"" displayed by this government and just the opposite. Credible reports of ""incompetence and Scandal"" Come Come don't be shy. Let me start you off and you figure out which side I'm on. Oda office alters document Integrity Commissioner disappears RCMP Commissioner resigns Arena in Quebec supported by Tory MPs Putting the tooth paste back in the tube.  Bernier opens 101 debate in Quebec. That is the last few days. There are 1825 more stories just like it. On the positive side we have. 2% lower GST.... Wait that put us further in debt. Well there was the $56B stimulus program.... Wait that was forced on them, but they did get to use the funding in CPC ridings and take full campaign credit for it. The taught us more about proroguing parliament. we really needed that."CommentKey:5d6b4bba-4428-4ed9-8123-a617ebc01189	2000415568	Sat Feb 12 2011 12:10:14 GMT-0500 (EST)	PeterDN	11	"WindMaster wrote:Posted 2011/02/12 at 11:37 AM ET ""Unfortunately, 85% of people just do what everybody else does. This is a proven fact and these polls just assist with that."" -----------------------------  If this is a proven fact, then would you be so kind as to provide a link to it please?  However, you are right that some people do base their voting on the polls and not by critically reviewing the policies, actions, and words of the various parties.  For the most part, I agree with your post. Of course, I know from your previous posts your implication is that the Conservative voters are the ones who should ""have to be tested"".  Posted 12:10 PM ET"CommentKey:c491ca6e-e8ac-4627-adeb-387490496468	2000415568	Sat Feb 12 2011 12:10:57 GMT-0500 (EST)	oldgreg	6	"redforever wrote:Posted 2011/02/12 at 11:19 AM ET  Bumpy Road wrote: ""I feel sorry for those who have been tricked into accepting the vote rape drug that the Cons offer freely. It must be so soothing as it slides drop by drop into the ear canal.""  Do you or any other Liberal really expect to be taken with any grain of seriousness with a comment like this?  =======  You do realize that your Reformatory friends make many outrageous comments here too? Yes? If a person were to respond to them all they wouldn't have time for much else in their day.  What I find more significant is when people like John Baird make public statements which claim the CPC decision regarding a couple of flights a week  from the UAE represents defending against the possible loss of tens of thousands of jobs at Air Canada. Tens of thousands no less.  How can anyone take that party seriously when senior members make ridiculous statements like that?"CommentKey:7fd83a15-65c0-4206-9b92-431bdb9cdb2a	2000415568	Sat Feb 12 2011 12:11:18 GMT-0500 (EST)	Martini	8	"Harper still, unfortunately, holds all the cards.  Ignatieff is feeling his shelf life running out and so is damn the torpedoes, lets have an election.  Layton was rupturing himself by sitting on the fence and giving himself options with a pretty grim Seat Projection for the NDP if an election is held now, and it just got even worse. He is the only one who can avoid an election.  However, if Harper wants an election now that he can sniff the much much desired Majority, well, all he needs to do is not cooperate with the NDP and put something in the budget Layton can't live with.   It is not missing in Harper's political bag of tricks to do so. He just can't make it obvious that he really wants to jump on the opportunity."CommentKey:24114b5f-ad83-463d-80bb-2ef4f52aedc6	2000415568	Sat Feb 12 2011 12:11:51 GMT-0500 (EST)	redforever	12	"skye60 was complaining about the high cost of food and wrote:   ""I bought a tub of spread for my toast the other and noticed when I got home that the bottom was cone shaped and now held 50% less than it used to.""    Really now, you never noticed that PRIOR to you bringing that tub of spread home?   lol, and personally, I would like to see that container. It would need to have a hell of an indentation on the bottom to hold 50% less. Care to tell me the brand name of that tub of spread so I can check it out myself?  I mean, surely you are very interested in warning other Canadians who also buy that tub of spread, aren't you?"CommentKey:0f171809-8a13-4f93-80b3-9d026cddf653	2000415568	Sat Feb 12 2011 12:12:17 GMT-0500 (EST)	bgGruff	4	"david james wrote "" listening to the positive comments about Harper.."" --------- uh..let me see..ok..the crtc decision..uh..?"CommentKey:52082a5b-fc98-46e8-9034-c70071560feb	2000415568	Sat Feb 12 2011 12:13:18 GMT-0500 (EST)	swamprat	15	"In other news, literacy rates among the Canadian populace continue to plummet at an inverse proportional rate to the popularity of the Conservative Party of Canada. --------------------------------------------------------- What a wonderful country, even we ignorant, inbred rednecks get to vote.  Mind you, it doesn't take a PhD to understand bitter."CommentKey:1a62fb1f-32b1-44e2-9146-dcef88c0a3c3	2000415568	Sat Feb 12 2011 12:13:34 GMT-0500 (EST)	Con Crusader	18	"Listen up lefties. Canada has changed to the right and caught you sleeping. The right wing dominates the media, and just wait until Sun News goes on air with our point of view. This is the way we do things now around here, and it shows in the polls already. The Conservatives are united and will be in charge for a really long time. After the next election looks like we won't have to pay any attention to the left, and you won't do anything about it. Being in power has its perks. Stephen Harper will be on the right side when the trumpet sounds."CommentKey:4a77ce98-fce0-4cdb-be7d-1f13213ca7c0	2000415568	Sat Feb 12 2011 12:13:39 GMT-0500 (EST)	Aulden Gray	4	Even more evidence that vote splitting on the left will ultimately give Mr. Harper his majority.  Watch for even more attack ads from the CPC along with ads which set opposition parties against each other.  Elections are no longer about what the majority of people want.  They are about which party/parties you should hate.CommentKey:a9aab6f7-60d8-4838-a492-88409bd3c340	2000415568	Sat Feb 12 2011 12:13:46 GMT-0500 (EST)	cowen75	21	Iggy is about to get Kim Campbelled.CommentKey:1b054709-efa9-4275-b902-044458db477a	2000415568	Sat Feb 12 2011 12:14:18 GMT-0500 (EST)	James in Kanata	22	"This poll just shows what every Canadian already knows: Harper is doing a good job and is poised to become one of the best PMs in Canadian history.    If Ignatieff forces an election, Harper will get a majority. We don't want nor need an election when we have a functioning, effective government.  The question is, why did the CBC wait until Saturday morning to post this?  I guess the CBC can't publish bad news for the Liberals during the week."CommentKey:b5867b66-1064-44ef-a5cc-54026ceef002	2000415568	Sat Feb 12 2011 12:15:23 GMT-0500 (EST)	St. Poptart	17	"LOLOLOLOLOLOL ....  All you leftists waste hours of your day making wasted posts.  Once Stephen Harper gets a majority, he'll be in power for decades, because Canadians know he is a good leader."