Comment ID	Article ID	Date	Name	Recommendation Count	Body
CommentKey:02bbaa03-be66-4f7f-8a37-721bcc579a7b	2000415835	Mon Feb 14 2011 10:38:27 GMT-0500 (EST)	BilderbergGrp	6	The protesters don't need to go, what harm are they doing?? ;   The pattern of war for profit is beginning when the military begins to incite the people like this.    In Naomi Kleins book The Shock Doctrine, Stephen Kinzer explains this pattern well.    Stage one; a US based multinational corporation is threatened in some way.    Stage two;  US politicians reinterpret this threat as an attack by transforming the situation from an economic one to a political.  They do this by stating the government must be dictatorial, oppressive etc.  Stage three;  US politicians then sell the need for intervention as a struggle between good vs evil, sound familiar?    Now, with the threat of war hanging over their heads do you think the people will strike?   I bet the war mongers have their fingers crossed....
CommentKey:76339ef2-579e-479c-b766-3f702e4549f8	2000415835	Mon Feb 14 2011 10:38:32 GMT-0500 (EST)	spreadnolies	3	I see history oneOnone is here to open the fear mongering.  What are you so worried about?
CommentKey:41b8d105-b64c-4ce3-8efc-255423547874	2000415835	Mon Feb 14 2011 10:39:18 GMT-0500 (EST)	petes42	6	wwwang wrote:  Your Mothers Britches wrote: " What pipe dream have you been living? nearly 40% of the Canadian electorate didn't vote last Federal election!" --------------------------   And yet by most estimates the crowd of protesters was only 250,000 - 350,000 or less than .003% of Egypts population   ---  Are you trying to say that 11.7 BILLION people live in Egypt?
CommentKey:97850e3f-31e1-4bc3-940c-af3e1b01a993	2000415835	Mon Feb 14 2011 10:44:33 GMT-0500 (EST)	ClaireVictoria	3	While our Prime Minister has called on Egypt to establish Democracy, including a Free Press, in Egypt, he's under investigation himself.  I very much doubt that the CBC will post this news because so far it hasn't reported that the ICC is conducting preliminary investigations into whether Stephen Harper and Peter MacKay are in breach of the Geneva Convention and have launched an official war crimes investigation:  http://presscore.ca/2011/?p=1167  Let's see how "free" our Canadian media is.
CommentKey:d94c14c0-4725-4990-ae19-d39e2d834fce	2000415835	Mon Feb 14 2011 10:47:33 GMT-0500 (EST)	DedoShahino	0	Guess again .. there were 18 million protesters =) !! ..
CommentKey:e913e741-4604-4cf3-bdb7-c50d957c3a99	2000415835	Mon Feb 14 2011 10:55:40 GMT-0500 (EST)	mrjoemac	2	Let them stay drink smoke pot do whatever they have to do for freedom for all religion and sexs.
CommentKey:854e710c-fc9f-4f93-b073-640ed12c259c	2000415835	Mon Feb 14 2011 10:56:25 GMT-0500 (EST)	carlbailey	2	"ban strikes"?? "go home"??  yep, sure does look like that thar democracy bug bit somebody in the arse, all right...
CommentKey:c0a9ed20-15de-4b73-ae2d-e56777cfc340	2000415835	Mon Feb 14 2011 11:00:25 GMT-0500 (EST)	LoudCricket	2	Situation Report From: Field Marshall Muhammad Tantawi Attn: President Mubarak, Vice President Suleiman, President Obama, Vice President Biden, Secretary of State Clinton  Mission continues.  Situation diffused. De-escalation methods continue. Mopping up remaining protestors. Sanitizing protest locations. Re-establishing control system and sense of order using "calming" procedures. Installing ban on strikes (likely to include large gatherings). Beginning Phase II of "Operation Trackdown" targeting known protest figureheads. Will await for further orders to move on to Phase III. Phase IV of "Operation Dupe (the citizens)" underway. Political situation stabilized.  End of cable.   The more things change.....
CommentKey:4cd8999e-8b99-43a6-aaba-4afb24a46e27	2000415835	Mon Feb 14 2011 11:01:14 GMT-0500 (EST)	Seeingblue	5	"The military junta is now in charge of Egypt's destiny.  Yes, junta members in Cairo were going from one TV studio to another yesterday to promise that the military rule installed in the wake of Mubarak's departure would be "temporary." But that is precisely what Gen. Muhammad Najib, who led the 1952 coup, also promised. " Read more: http://www.nypost.com/p/news/opinion/opedcolumnists/will_the_army_let_go_Sbwk26ik4Cm0PhMq4iwflN#ixzz1Dl2ndaou
CommentKey:80227f5d-6ebf-4e69-b2c6-2368ab614e42	2000415835	Mon Feb 14 2011 11:01:43 GMT-0500 (EST)	SASCZ2	2	logicman1 wrote:Posted 2011/02/14 at 8:33 AM ET  Logicman 1. you write like you know the stuff. Unfortunately what you say is BS. Are you member of a party which didn't elect its leader. Ignatieff was  installed by few party officials who live in shadows.
CommentKey:90248010-bce6-4f38-b6ad-82abfe47830f	2000415835	Mon Feb 14 2011 11:01:48 GMT-0500 (EST)	Mikethespike	7	logicman wrote: "We have a general election where the majority of canadians Did NOT vote for this "right wing" coalition. (we DID have a say in this, but it didn't work) So, here we are being governed by s person who is supported by large coorporations and seems to have "dictator" style leadership" ******************************************************************************************   It's not the Conservative's fault the spoiled brat Canadian left can't agree on what to have for breakfast, let alone amalgamate.  If you guys want to vote Liberal/NDP/Green instead of for one party, knock yourself out.   Just don't come crying when your vote is split half a dozen different ways. That's YOUR problem.
CommentKey:d3ded6f7-22c7-4fea-ba31-9809d4b3363a	2000415835	Mon Feb 14 2011 11:11:28 GMT-0500 (EST)	peace-out	2	ahahahaha We are Free!!!
CommentKey:012f4d81-15af-48e0-ae26-e5e51300ec15	2000415835	Mon Feb 14 2011 11:21:26 GMT-0500 (EST)	Alexdelarge	3	So here we go again.  I hope this doesn't end up being a demonstration of the fact that Twitter and Facebook are good at getting people together in a crowd, but not good at bringing about real change.  For that you need strong, organized institutions.  It's time for those institutions, including the unions, to stand up.
CommentKey:b758a122-15e6-4b76-91bb-507610367044	2000415835	Mon Feb 14 2011 11:27:27 GMT-0500 (EST)	Seeingblue	5	"    The Egyptians are divided in assessing whether Islam should play a significant political role in the country today. But a massive majority of 85 percent believes it should. Islam should not only be a faith; Islam must have power.      What kind of Islam? Pew asks whether people distinguish between “innovators” and “fundamentalists” within Islam. Most Egyptians do not. But among those who do distinguish, far more people identify themselves with the fundamentalists than with innovators — 59 percent versus 27. Other aspects of the Egyptian attitudes are also astounding:  82 percent are in favour of punishing adultery with stoning to death. 77 percent believe that thieves and robbers should be punished by flogging or the amputation of a hand. Fully 84 percent believe that one should be punished by death if he leaves Islam!" http://gatesofvienna.blogspot.com/2011/02/egyptian-thriller.html#more
CommentKey:423eba08-e3f3-4346-8f74-4b5ebfe5d187	2000415835	Mon Feb 14 2011 11:29:07 GMT-0500 (EST)	LoudCricket	4	In a future Wikileaks release, a document not much unlike the following might be found....  Situation Report From: Field Marshall Muhammad Tantawi Attn: President Mubarak, Vice President Suleiman, President Obama, Vice President Biden, Secretary of State Clinton  Mission continues.  Situation diffused. De-escalation methods continue. Mopping up remaining protestors. Sanitizing protest locations. Re-establishing control system and sense of order using "calming" procedures. Installing ban on strikes (likely to include large gatherings). Beginning Phase II of "Operation Trackdown" targeting known protest figureheads. Will await for further orders to move on to Phase III. Phase IV of "Operation Dupe (the citizens)" underway. Political situation stabilized.  End of cable.   The more things change.....
CommentKey:6b7372fd-7f07-4dd1-96b4-ad9ae5f2eda7	2000415835	Mon Feb 14 2011 11:29:29 GMT-0500 (EST)	CanadianCon	4	Everyone wants better pay but if there is no money what are you going to do? Their demands should have been for a new election instead of demanding President Hosni Mubarak out.  So now he's out the military is in charge. What a trade. Let the chaos begin.
CommentKey:0f827a06-b2c9-4b00-8d5a-1ff2d4f382e5	2000415835	Mon Feb 14 2011 11:39:25 GMT-0500 (EST)	molotovcoctiev	5	Wow, this is going to be like Iran over again. Replace a bad regime with a horrible regime. And didn't Mubarak step down to stop all this?
CommentKey:fa52c995-0897-49a0-93d9-45263947bb91	2000415835	Mon Feb 14 2011 11:41:29 GMT-0500 (EST)	UseOrAbuse	2	Mommas, don't let your babies grow up to be Dictators.
CommentKey:aa612fb4-3a20-470e-b573-c0804f650da3	2000415835	Mon Feb 14 2011 11:44:05 GMT-0500 (EST)	wwwang	8	petes42 wrote: are you trying to say that 11.7 BILLION people live in Egypt? -----------------------------  Okay so I missed a decimal point don't have a cow. ------------------------ spreadnolies wrote: Posted 2011/02/14 "Wrong again wwwang. MOST Egyptians support change. Only some of the wealthy were happy with the Mubarak status quo.' ---------------------------   Oh I'm sure they do.  But the point was this decision was made on the basis of the number of people who showed up for the protests.  As the earlier poster  complained that Canadas gov't was  decided on less that 40% of the population voting.  This decision was made by even fewer, 33 million people did not protest. (maybe they supported it but nobody knows for sure)  If Canada had done the same Harper would have had to have stepped down after the last G20 convention, and then who would we have had?  What's the better method of deciding if a Gov't should stay in power?  By estimating numbers at rallies or by voting?     Look where the protesters impatience has gotten them  now the military is directly calling the shots, there is no  president and no cabinate.  Is this any better?
CommentKey:5ac3e8ea-8b90-4179-861f-6e66dc7dce52	2000415835	Mon Feb 14 2011 11:44:46 GMT-0500 (EST)	StevenHarp	6	Over the past few weeks there have been many references made to this being the beginning of "New World Order" . The peaceful demonstration of the public to enact change in the way government rules it's people. This is nothing more than an attempt to paint a friendly face on that terminology.  This is not the "New World Order" as it was intended. For the truth behind that Google it. It is far more alarming than the main stream media would have you believe. Egypt is not it's birth place or it's poster boy. If anything this would be the old world order. People Power. The New World Order is control over the masses by a very few powerful few. See the difference. Deny the obvious.
CommentKey:77869a54-ddb7-49cf-9596-b1d88be867de	2000415835	Mon Feb 14 2011 11:46:12 GMT-0500 (EST)	BilderbergGrp	2	Let's see how "free" our Canadian media is. ------------------ And by the thumbs down on this comment it looks like the media has it's hound dogs out today.
CommentKey:11eb46ff-c284-4fb0-ac47-4a7d9cd3f6b6	2000415835	Mon Feb 14 2011 11:49:09 GMT-0500 (EST)	TellTheTruth	5	Relief for US imperial bully and their zionist masters. Dictator replaced by military junta.  One problem:  If Egyptians decide to sacrifice a lots of blood, junta will fall and instead of moderate democracy radical Islamic regime (like the one in Saudi Arabia, just anti-American, anti-zionist)  will prevail... or Iran, stage II? Obama, Bibi, wanna bet?
CommentKey:c4b28ef3-3356-46d5-94fb-35d915ed7a39	2000415835	Mon Feb 14 2011 11:56:41 GMT-0500 (EST)	Arcaul	4	Egypt has been a military dictatorship ever since the military overthrew the king in 1952. Mubarak angered the military by wanting to put his son, Gamal, who was never in the military into the office of president. The protests only succeeded because the military staged a coup so they could come back into power.   http://www.stratfor.com/weekly/20110213-egypt-distance-between-enthusiasm-and-reality?utm_source=GWeekly&utm_medium=email&utm_campaign=110214&utm_content=readmore&elq=9655914a46ae4533844c156112ad5b69
CommentKey:b576c2e4-5d26-4c52-b99c-55b4c05675ea	2000415835	Mon Feb 14 2011 11:57:34 GMT-0500 (EST)	TellTheTruth	5	Obama-democracy finally prevailed. Netanyahu can breathe again.  P.S.: All dictators, including Harper, are terrified of democracy.
CommentKey:442b33ea-d776-45d4-ba14-1c2ea05f9834	2000415835	Mon Feb 14 2011 12:00:03 GMT-0500 (EST)	lebrundood	5	It's usually the people that don't vote that complain about the government, wages and taxes cause they are too lazy to vote. Just say'n
CommentKey:1bd0263f-36f3-487b-b80e-aa01281fdb98	2000415835	Mon Feb 14 2011 12:03:08 GMT-0500 (EST)	Mavroi	8	Egypt is under a military dictatorship but I guess we should rejoice that Mubarak is gone. So what has really changed...nothing..but the toothpaste is out of the tube. Maybe Harper was right for not jumping with joy...he knew nothing would change. More turmoil ahead for Egyptians sad to say.
CommentKey:575c66d8-3d31-4b33-846b-64132a45b179	2000415835	Mon Feb 14 2011 12:05:27 GMT-0500 (EST)	chacham	8	I am sure that the radical groups are out in full force to continue to stir things up so that they will be able to get control of the country. It was quoted earlier that these protests were instigated by outside foreign influences, although they did not say who these were( Iran or the U.S. or both is my guess). (maybe sunspot activity) Be careful what you wish for. I'm praying for a peaceful future.
CommentKey:95e4954e-87f0-44e9-99d5-c8b286d1530a	2000415835	Mon Feb 14 2011 12:09:07 GMT-0500 (EST)	Anarchy Rules	3	"Mommas, don't let your babies grow up to be Dictators."  The way to do that is to not to be dictators yourselves.
CommentKey:4734498b-107c-4b0d-8d58-646a630f9834	2000415835	Mon Feb 14 2011 12:15:10 GMT-0500 (EST)	Burning Hazard	2	"it is about time. The people running the protest ( outside the country) got the change  Canada wake up and remove Harper"  ObamaHarper fails at democracy...
CommentKey:d3dfe63e-12ee-40f2-b852-91af2e659ab5	2000415835	Mon Feb 14 2011 12:15:17 GMT-0500 (EST)	Mikethespike	8	The protesters would have been better off had they let Hosni direct an orderly transition.
CommentKey:2a4d70a7-089e-4152-8bdf-424f127f6a0a	2000415835	Mon Feb 14 2011 12:15:54 GMT-0500 (EST)	ByeByeNDP	5	This is how to end the strikes and protests in Egypt and to create a lunch buffet in Tahrir square. Make our very own Canadian comedian Russell Peters the official spokesman for the military and he could say (in his east indian standup lingo) "now you people listen to me. Go back home immediately, or I will bring back that old man Mubarak from his vacation home". Everyone vacates, and there's kabob buffet all over the place.
CommentKey:8e6acc4c-1f1d-4698-8366-bbac2ad70d3e	2000415835	Mon Feb 14 2011 12:18:49 GMT-0500 (EST)	mvanden	13	Your Mothers Britches wrote:  " What pipe dream have you been living? nearly 40% of the Canadian electorate didn't vote last Federal election!"  --------------------------   And those 40% of Canadians that did not vote have no right to any representation whatsoever.  The fault is ENTIRELY theirs -- I have no sympathy for them.
CommentKey:7da717ca-74d8-49af-9778-221045f5165c	2000415835	Mon Feb 14 2011 12:20:46 GMT-0500 (EST)	TroyAB	2	To the parliament of Canada, To lead by example is what new democracies will be looking for.  The world is on the verge of an epic acceptance of a value set that builds on the core of human rights. A critical part of this value set will be dedicated to energy and the role it plays in prosperity. I believe this value set will be part of a future requirement of Canadian politics starting with the potential of each human being on this planet.  The potential of anyone to contribute to the basic nature of what it means to have access to prosperity, the unyielding access to contribute to their own prosperity. To recognize a resource based economy as the only way forward. To globalize the recognition of humanities potential to overcome our collective weaknesses, by allowing a pathway to prosperity that is universally and undeniably accessible.  There is pathway towards prosperity that leads an accelerative convergence to that which is scientifically sustainable. The global common denominator to the renaissance of our time is energy and how accessibility to energy can provide the prosperity to all humanity unimpeded by sovereignty and the endless variety of governance failures to deliver this promise. Canadians must recognize our collective responsibility to use our capabilities based on our scientific and social successes to converge with common purpose on that which is sustainable. The forces of global governance is waiting and wanting this paradigm, a shift which is gaining traction and it has been a long time coming.   Think of sovereignty as important as it still is, as the last Castle wall denying prosperity for all humanity, the invisible line in the sand dictated by the few.  The Governance of Canada needs to step up. Seriously, step up.
CommentKey:6dcf839e-4e1e-4d1b-973d-2137d2427894	2000415835	Mon Feb 14 2011 12:33:50 GMT-0500 (EST)	hchalice	9	TellTheTruth wrote: Posted 2011/02/14 at 11:57 AM ET  "P.S.: All dictators, including Harper, are terrified of democracy."  =================================  This is about Egypt... Please stop insinuating your personal obsession into every issue.  Surely CBC ... you could have a placebo blog where narcissistic "Eeyore's" can complain to each other.   Remember Eeyore? Remind you of any whiners in this neighbourhood?  - An "old grey donkey - long, detachable tail with a pink bow on the end, of which he is very fond - apparently able to write, or at least recognize letters such as the letter A that he teaches to Piglet - lives in the southeast corner of the Hundred Acre Wood - in an area labeled "Eeyore's Gloomy Place: Rather Boggy and Sad" - He has a stick house therein, which collapses rather regularly - He has a poor opinion of most of the other animals in the Forest, describing them as having "No brain at all, some of them", "only grey fluff that's blown into their heads by mistake" - Eeyore's favorite food is thistles.
CommentKey:fd035adb-e27a-47ea-83ec-ecdb13e2979a	2000415835	Mon Feb 14 2011 12:43:27 GMT-0500 (EST)	GRANT THE TRADESMAN	4	Canadian history,Liberal Government passes martial law.
CommentKey:fffbe84f-f15a-4820-bd53-71a817098d97	2000415835	Mon Feb 14 2011 12:49:26 GMT-0500 (EST)	Mavroi	3	Is this what the people in Egypt really wanted...rule by military dictatorship. What did they think would happen...sudden democracy..Western style..in an instant. Sometimes you have to worry about what you wish for...getting rid of one dictator for another is nothing to sing and dance about...but the toothpaste is out of the tube...
CommentKey:17cad0be-991d-43af-8ac0-ee286d544bf8	2000415835	Mon Feb 14 2011 12:51:42 GMT-0500 (EST)	MaddCauw	1	Anarchy Rules wrote: Posted 2011/02/14 at 12:09 PM ET  --------------------------  I doubt dictators beget dictators as much as prophets beget prophets or thieves beget thieves, etc.  However, I'm inclined to believe that bullies are most likely to turn into dictators.  Why?  Simply because both have an urge to dictate and are ready to use force for that.  Those who don't use force go into corporations.  Salesmen and saleswomen too are bullies in their own right.   May be it is politically incorrect to say, but the west has a significant amount of bullies and potential dictators.   Now to fight bullies you can resort to anarchy, which is the anti-thesis of bullying, but no less bully either.  In short, being bully is the norm.  Those who are bullied should simply take the courage and give the bully its change.  To submit means you'll die anyway so you take the bully with you as well and have that animal judged in heaven.  But again this might be too politically incorrect to say.
CommentKey:fd96709e-edfd-4919-882c-b8e67e231f5a	2000415835	Mon Feb 14 2011 12:54:22 GMT-0500 (EST)	rosecomments	3	I would suggest the American's,after their( agreement with face book and twitter to be able to see all contents), therefore have an advantage in say supplying Egypt with tear gas well in advance, And an unfair advantage to warn the leaders or dictators, they like, well ahead , if the youths are planing to protest or overthrow a corrupt government.
CommentKey:e2305248-0dda-4ee5-81b5-831e2b1f068f	2000415835	Mon Feb 14 2011 12:58:14 GMT-0500 (EST)	b.c. terry	7	Bottom line.  "On traditional Muslim practices      * Should men and women be segregated in the workplace? 54 per cent said “yes” and 44 per cent “no.”     * Should adulterers be stoned? 82 per cent said “yes.”     * Should apostates from Islam face the death penalty? 84 per cent said “yes.”     * Should thieves be flogged or have their hands cut off? 77 per cent said “yes.”
CommentKey:406d7178-dcea-4507-8eed-f4e32dbe07fe	2000415835	Mon Feb 14 2011 12:58:41 GMT-0500 (EST)	pigmore	3	The military will not give in to them. They will push their luck too far and there will be another Tiananmen Square. Power of the people will not stand up to tanks, and military might.
CommentKey:5c77236d-2c2f-4f39-941b-61686f4ac575	2000415835	Mon Feb 14 2011 13:02:48 GMT-0500 (EST)	Seeingblue	3	"The Egyptian military is, for now, looking like a force for democratization. It should not be forgotten, however, that the military is an oligarchy which controls huge swaths of the Egyptian economy.   SFChronicle: It owns companies that sell everything from fire extinguishers and medical equipment to laptops, televisions, sewing machines, refrigerators, pots and pans, butane gas bottles, bottled water and olive oil. Its holdings include vast tracts of land, including the Sharm el-Sheikh resort, where ex-President Hosni Mubarak now resides in one of his seaside palaces. Bread from its bakeries has helped head off food riots. Time notes: Another source of the military's untold wealth is its hold on one of this densely populated country's most precious commodities: public land, which is increasingly being converted into gated communities and resorts. The military has other advantages: it does not pay taxes and does not have to deal with the bureaucratic red tape that strangles the private sector.  ...The revenue streams from its various holdings help the military maintain the lifestyle its officers have grown accustomed to, including an extensive network of luxurious social clubs as well as comfortable retirements — all of which helps ensure officer loyalty. Not surprisingly, the military has opposed privatization and economic liberalization. The Egyptian military currently commands a great deal of respect in Egypt but what happens when a nascent democracy tries to reform an entrenched oligarchy?" http://www.marginalrevolution.com/marginalrevolution/2011/02/the-pharaoh-and-the-comannding-heights.html#comments
CommentKey:94312fec-bc13-4b07-beb8-ba0ce639c1ab	2000415835	Mon Feb 14 2011 13:04:36 GMT-0500 (EST)	davegravy	5	What assurances are there?  Just because Mubarek claims he has relinquished power, and is physically absent from government buildings, doesn't mean he's not still mostly in control of the country. He has money, and he has powerful friends - some of which probably owe him a favour or two.  If I were an Egyptian I'd want some assurances. I'd want Mubarek in custody, monitored 24/7 by a civilian group. He should not have access to communicate with any of his cohorts.
CommentKey:9234425b-58c5-4ce6-87f0-f828d7e1899e	2000415835	Mon Feb 14 2011 13:05:17 GMT-0500 (EST)	mikem_van34	3	This is a critical day for Egypt.  Will the protesters be prudent enough to accept their win and let the dust settle, or will they foolishly push their luck and ruin it all?
CommentKey:474ae574-0c52-4428-ae19-4a05c15e30c1	2000415835	Mon Feb 14 2011 13:12:00 GMT-0500 (EST)	StevenHarp	4	mvanden wrote:Posted 2011/02/14 at 12:18 PM ETYour Mothers Britches wrote: " What pipe dream have you been living? nearly 40% of the Canadian electorate didn't vote last Federal election!" --------------------------  And those 40% of Canadians that did not vote have no right to any representation whatsoever. The fault is ENTIRELY theirs -- I have no sympathy for them. --------------------------------- Your point is well taken but...... As one who has never missed the opportunity to vote( in a free and fair election.... sarcasm) I feel compelled to point out the obvious. The promised made pre election are seldom reflect in the out come. My ability to vote in a democratic is neither free nor fair. I am compelled by fear to vote against that party that I determine would do the most harm or less likely to represent my values. I am not free to vote for whom I see will govern in the most responsible way. I am forced to consider the lesser of two evils both of whom answer to and cater to the elite. Neither of whom would every consider an alternative method of equal representation. As I vote in every election should I not be entitled to the "right of representation". I wonder who is more delusional those who do or those who don't? How does this relate to issues in the Middle East? Democracy has many faces. A free vote does not a Democracy make.
CommentKey:002fd2cc-c2bb-473f-90ce-36c109dbdfa4	2000415835	Mon Feb 14 2011 13:13:24 GMT-0500 (EST)	willium	7	I think it is way to early for them to be protesting for things like higher wages. First things first, get a stable, democratically elected government going.  They need to step back a bit and be patient. There will be a time to handle those issues.  As they say, Rome wasn't built in a day.
