Comment ID	Article ID	Date	Name	Recommendation Count	BodyCommentKey:11d11157-e2c3-4519-b9a0-d58929e348a0	2000415568	Sat Feb 12 2011 16:13:09 GMT-0500 (EST)	MaryClarke	19	"People are tired of the usual Liberal tactics of pandering for votes,rather than doing what's best for the Country.. From the Globe: The passage of long-needed refugee reform legislation, now imminent, has required too many contortions on Parliament Hill. But the Conservatives, Bloc Québécois and NDP are to be commended for working together and getting a deal done, while the Liberals should wonder what their last-minute intransigence gained for them, or for the greater benefit of a more streamlined refugee system.  The need for reform was never in doubt. Refugee claims take too long to process, making the transition to Canada for genuine refugees more difficult than it ought to be, while dubious claimants can access a seemingly endless appeals process to stay in Canada for years. The legislation tabled in March by Jason Kenney, the Immigration Minister, created a better system in both regards.  Last week members of the Liberal Party caucus revolted against the bill, despite compromises arranged between Mr. Kenney and their own immigration critic, Maurizio Bevilacqua.  But good sense won the day. The Conservatives, who could have toughened their stance or made political hay of the Liberals' tactics, looked for other legislative partners. The NDP and Bloc played a constructive role, agreeing that reform was needed and gaining changes important to their supporters.  Ignatieff also firmly believes that daggers should be allowed in Parliament,once again pandering for the Minority vote."CommentKey:430a0230-29aa-4d06-a226-dfbe7e98e584	2000415568	Sat Feb 12 2011 16:14:08 GMT-0500 (EST)	Handiman	4	lots of reasons not to vote CONS only one not to Fiberal they're Liberals---both parties stinkCommentKey:8c179a62-54ab-4242-b350-92b0cd5a54c4	2000415568	Sat Feb 12 2011 16:15:26 GMT-0500 (EST)	Denis 	6	"Get rid of Ignatieffe & the Libs will make the Cons disappear! Seriously though, I have to wonder what seems to be the problem with the Lib Party in not getting rid of that wonder boy from Harvard. We know he's useless,and they must know that he's useless as well, as an opposition leader. Is this what the Big Boys on Bay street want? A useless opposition?One that will allow super tax breaks to the Big corporations, and the rich,will spend like hell, and further erode our safety nets? Makes me wonder! It's like we have two P.C. parties , one with the name Liberal, and the other with the name Conservative.  Looks to me like the two big parties are in cahoots! After all, the Libs organizers can't be o stupid as to WANT to lose an election, can they?"CommentKey:d96e9e8d-f602-4566-9a33-ba055be27975	2000415568	Sat Feb 12 2011 16:16:49 GMT-0500 (EST)	DJ1951	14	"RE: Unbelievable! What exactly does Mr. Harper and his group of idiots have to do before people wise up. His ""top"" Ministers are either outright liars or totally incompetent. Here's Mr. Flaherty, no recession, no deficit, minimal deficit, deficit done by 2012, 2013, 2015, and on and on. Mr. Clement spends money on his riding like he was renovating his basement! They promise an open government and then run the most closed ever! They will say anything if they think it will get them electted and then do the exact opposite. if this isn't the worst government in history I don't know what is!  Response: Think of it this way.  Instead of blaming the ""voters"" for their decisions maybe you should have your party re-think its' positions on some of the issues of the day.  I don't see your current ""shoot the messenger"" plan of attack being effective in the long run.  And, yes there have been much worse governments over the years.  Witness the BC, Quebec and Ontario governments in power today and tell me if any are going to be in power after the next election.  No, the truth is that Canadians don't trust the Libs or the Dippers whether it be provincially or federally to run a province or a country.  Harper is in like Flint!"CommentKey:1ec96ad5-88b2-428f-a2a8-19923bdde33e	2000415568	Sat Feb 12 2011 16:18:05 GMT-0500 (EST)	RomeoCostello	2	"ljhnsn61 wrote: ""Oh and PLEASE people stop calling us a democracy""  Wow, do you really mean that?: Are you a Conservative voter?  DEMOCRACY: ""the political orientation of those who favor government by the people or by their elected representatives""  Why don't you try living in a third world and surrender your rights to the government. YIKES! The ignroance is frightening!!!"CommentKey:af134bd3-1d52-43e0-976f-7420144bb072	2000415568	Sat Feb 12 2011 16:19:48 GMT-0500 (EST)	SuperSod	15	"But you forget that Ignattief's and Layton's supporters can come together to form a coalition government that supported by the Block will represent 48.8% of the country? This is called democracy ================================================  So in effect, the country would literally be run by a bunch of losers - not a democracy to be proud of that's for sure. Oh, and power in the hands of a group that would do anything to rip the country appart.  Shame on you for even considering such an option. Shame on you!"CommentKey:6a16d8ab-bc52-4e0e-99cb-47dea7b40e68	2000415568	Sat Feb 12 2011 16:20:17 GMT-0500 (EST)	GaryNelson	20	"RomeoCostello wrote:Posted 2011/02/12 at 4:04 PM ETExplain to me how you can give a thumbs down to the fact that Harper has created a $56,000,000,000.00 deficit and this is somehow a good thing and a reason to vote for him?  Please CON TROLLS, explain. Don't just click the thumb. ************************** Personally, I am very curious to know what the deficit would have been without the threat of the coalition coup attempt.   If you'll remember, they ended up ""working together"" on this deficit."CommentKey:78c236ce-0bfe-4007-9eb6-c032e0080da9	2000415568	Sat Feb 12 2011 16:21:11 GMT-0500 (EST)	Roger Simpson	7	"I've read comments fomr both paid parties on here.  Yes fellas we can tell that you work for the Liberals and Conservatives, we are not that stupid.  From what I have read you guys have reinforced my thinkin that we shoudnt give either party a Majority Government.  Both of you are capable of mucking up a good thing so I say let it be another minority governement.  BTW I dont know any regular Canadian (Not paid by the Partys) who wants an election."CommentKey:cc495581-8515-425b-b890-73713c1577ad	2000415568	Sat Feb 12 2011 16:21:22 GMT-0500 (EST)	RodNVan	17	"Emmy P Citizen wrote:Posted 2011/02/12 at 2:36 PM ET  If these numbers are any where near real, which I highly suspect because land-line polling means you're only sampling folks over the age of about 45, then Canada has been fooled by a dog and pony show.   Remember Conservatives, the Internet spurred the youth to revolution in Egypt, not a bunch of aging malcontents jamming up radio call-in shows. -----------------------------------------  If you're going to equate what happened in Egypt: the Liberals should remember that the Egyptian uprising and social media campaign was sparked by wage and price controls that saw the doubling of food prices in a matter of months, among other changes.  Then the army was sent out to the streets.  In Canada the last leader who implemented wage and price controls AND sent the military out on the streets was a Liberal prime minister....  I'm pretty sure the Conservatives are not exactly quaking in their boots, only because a minor but loud sector that would never have voted for them in the first place, are making that threat...."CommentKey:2a976ece-aec5-47c1-8eab-30045b402225	2000415568	Sat Feb 12 2011 16:23:31 GMT-0500 (EST)	RGerald	3	"it'd be nice to see an election to see how far off the poll is.   So far it's pretty clear ""lefties"" are voting to the right more often now, since pretty much all Canadians are lefties."CommentKey:76ba9184-508c-4895-abf6-afc80d26b83a	2000415568	Sat Feb 12 2011 16:23:33 GMT-0500 (EST)	widman	7	" Please CON TROLLS, explain. Don't just click the thumb.   Good luck with that! It'll be like getting Harper to explain how his policies are good for Canadians, or asking a BC LIB for the truth about BC Rail. Ain't gonna happen!  Read more: http://www.cbc.ca/politics/story/2011/02/10/ekos-poll.html#socialcomments#ixzz1DmY360eQ"CommentKey:34ca22fa-93ca-48c9-bee8-11269cea7cc3	2000415568	Sat Feb 12 2011 16:25:36 GMT-0500 (EST)	SOB_Van_Owen	9	"FactNotFallacy2 wrote: ""McCarthyism died out half a century ago. The label ""pinko"" has become dog eared, trite and over hackneyed. I am bored to death with hearing it."" ~ The word ""conbot"" ,on the other hand, is fresh and shiny new."CommentKey:ddc66010-8911-4520-8201-6145e559ff4a	2000415568	Sat Feb 12 2011 16:26:22 GMT-0500 (EST)	widman	9	"greenmonster asked: ""Am I totally wrong by saying that if there is a coalition formed, the party with the most seats should decide the makeup of the coalition.""  Yes! You are totally wrong. What matters in a coalition is that the total number of seats held by the parties involved in the coalition adds up to a majority. Prime examples right now are: Israel and Australia! The party with the most seats, unless that number alone adds up to a majority, does not have any special right to form the govt or be part of it!  Read more: http://www.cbc.ca/politics/story/2011/02/10/ekos-poll.html#socialcomments#ixzz1DmYQWd4T"CommentKey:842deaf2-bac0-4fc5-9818-a9537c3428ba	2000415568	Sat Feb 12 2011 16:26:24 GMT-0500 (EST)	GaryNelson	15	"widman wrote:Posted 2011/02/12 at 3:29 PM ET And just to note, a lot of people are capable of building a party out of nothing. The prime example would be the Chancellor of Germany in the 1930s who managed to build a strong unified govt out of the rags of small right wing fringe groups, perverts and racist factions. In the end, he turned out to be one heck of CEO, but probably the worst ""leader"" the world has ever known! ********************************* Well, you've gotten away from the Nazi associations and fear mongering for quite a while now but give the cons a couple of poll points and you are right back there out of desperation."CommentKey:afff5eb4-f3d2-4441-9038-89fb214fd517	2000415568	Sat Feb 12 2011 16:27:35 GMT-0500 (EST)	dkj125	12	"Denis wrote: This poll only reflects what other polls have shown, that is; that the people that vote Conservative, usually are the un-educated, gun-toting, right wing, shoot-em-up hillbillies & hicks, of which Canada has a seemingly abundant supply!  ------------------------------------------------------------------------------------ On the contrary Denis, people who typically vote conservative are the middle to upper class of society - i.e. the one's ""footing the bill"".  In Canada, you get rewarded for success and hard work.  If you do well in school (in a productive subject like Math, Economics, Science, etc), and have a strong work ethic, you typically can gain a high paying job, or can start your own business.  As you get older (into your late 20's and higher), you begin to realize that you are paying more than your fair share of taxes. You then begin to vote with your wallet so to speak.    To summarize, it is the well educated hard working Canadians who pay the most tax who are voting for the Conservatives.  You don't become sucessfull in life my being a ""stupid gun-toting hillbilly"".   The reason why liberals get so mad when they see the Conservatives in the lead, is that they realize that they will now have to have some personal responsibility and work ethic - and that frightens them.  People vote for the party that will make their lives better off. It's the economy and taxes that motivates conservative voters."CommentKey:717611bf-0905-47aa-8d3e-d9397e695ead	2000415568	Sat Feb 12 2011 16:28:16 GMT-0500 (EST)	E Camp 49	7	I wonder what happened to the $3 Billion dollar contingency fund.CommentKey:f7aa3d88-ad6a-48bd-b4c8-799c9e995360	2000415568	Sat Feb 12 2011 16:29:23 GMT-0500 (EST)	impartional 1	20	"This proves 2 things. 1: attack adds work on people with IQ's less than 80 2: one third of Canadians have IQ's less than 80  ---------------  One third can at least spell "" ads "".  Go figure."CommentKey:37a00736-1944-43b4-b1c9-8baf28fb0d36	2000415568	Sat Feb 12 2011 16:29:59 GMT-0500 (EST)	Mr_Miyagi	9	A true leader doesn't have to be a saint and could in fact be the devil. <><><><><><><><><>  Six million murdered Jews would dissagree with you. The ends never justify the means.CommentKey:49766580-027c-41fe-96c1-012988289de7	2000415568	Sat Feb 12 2011 16:30:56 GMT-0500 (EST)	refiner	15	Where are the lefties/liberals who were bleating for an election so recently? That would now be pulling the life support plug on the dying Libs and dippers. I encourage the lefties to go for it as soon as possible.CommentKey:d67ef1e8-b790-47b7-a0c4-f55ead4c9dd5	2000415568	Sat Feb 12 2011 16:32:08 GMT-0500 (EST)	DazzlinDino	13	"Denis wrote:Posted 2011/02/12 at 3:58 PM ET This poll only reflects what other polls have shown, that is; that the people that vote Conservative, usually are the un-educated, gun-toting, right wing, shoot-em-up hillbillies & hicks, of which Canada has a seemingly abundant supply! Hey! Don't get mad at me, That's what the polls said,not me!  The fact that you would post that is concrete proof that intelligence and education are two completely separate things."CommentKey:51fc1581-2290-4aca-8ac2-46fef43a62d7	2000415568	Sat Feb 12 2011 16:32:15 GMT-0500 (EST)	RodNVan	20	HalcyonMantra wrote:Posted 2011/02/12  at 2:26 PM ET I will take my 8 years of university educatiion and my years of real life and expwience as a fisher and computer programmer and physicist and leave Canada if the conservatives get a majority  ============================  Hopefully your Hover-Ferrari has enough trunk space for your stuff : )...CommentKey:bcf0cbc0-5315-4a76-a405-25f912ca7f5c	2000415568	Sat Feb 12 2011 16:34:20 GMT-0500 (EST)	Dr.Twitch	8	"Hosni Harper is finished, the overwhelming majority of Canadians will make sure this happens as we ride the Egyptian tide of PEOPLE POWER !!!"CommentKey:d0681ff0-9f89-4ebb-9d62-072c2380075e	2000415568	Sat Feb 12 2011 16:35:12 GMT-0500 (EST)	McWal_Job	11	Vote for Harper? I would rather gnaw off my own face.CommentKey:89fa392b-2004-4c5c-adee-26a150ad157e	2000415568	Sat Feb 12 2011 16:37:35 GMT-0500 (EST)	SOB_Van_Owen	12	Any guesses on which way the Con numbers will go as the economy keeps heating up?CommentKey:0e72ba63-fb34-4924-91fe-db7bcb684799	2000415568	Sat Feb 12 2011 16:39:52 GMT-0500 (EST)	JustAnAverageGuy	6	"RomeoCostello wrote:Posted 2011/02/12 at 4:04 PM ET ""Explain to me how you can give a thumbs down to the fact that Harper has created a $56,000,000,000.00 deficit and this is somehow a good thing and a reason to vote for him?  Please CON TROLLS, explain. Don't just click the thumb."" >>>>>  Unlike you I am a true centrist, not a wannabe and I am not a""CON TROLL"". Your answer can be found in my post of 4:10 PM."CommentKey:66407939-19ce-4e93-8685-b983b25e821b	2000415568	Sat Feb 12 2011 16:39:57 GMT-0500 (EST)	widman	6	"Rob in Calgary wrote: OK, so if you want a Coalition, then have the Coalition Partners call it out now and campaign and run on that platform. Then again, Ignattief has stated that ""There is no Coalition"". I guess your statement is calling him out as a liar huh!! If you want a Coalition, then the Liberals better get moving as they will need to win the most seats in the next election in order to be granted the opportunity to form one. I highly doubt the Govenor General is going to completely ignore an election result and grant the right to form the Government to a losing party. You don't get to play it both ways.""  Books and information regarding how our parliamentary system works are readily available on the net and at your local library. Intro to political science courses are available at your local community college. I suggest you follow up on them because there is nothing in our laws or traditions that requires any party, or group of parties, to announce coalition plans ahead of an election. Coalitions normally come about as the result of an election, not as something predetermined going into an election! All parties go into elections to win them. When there is no clear winner (meaning one party earns a clear majority) then coalitions come into play. When no party achieves a clear majority, then there are no clear winners. It is up to the parties, after the election, to decide for themselves if they can put together a coalition.  Also, the GG would not base his decision on which party had the most votes,  unless that party on its own held a majority of the seats. The GG's only question would be: Do the parties proposing a coalition collectively hold enough seats to form a stable govt?"CommentKey:79f662f1-261c-47d6-b3ce-711b33e15f8f	2000415568	Sat Feb 12 2011 16:39:59 GMT-0500 (EST)	canadaawakening	6	"Clearly, the Liberals have had their chance in government, and have blown it big time.  Now those days are gone for good, and they are not coming back!  We are now in a new era of Canadian politics, and there is no going back.  A new day has dawned, and our liberation is at hand!  The Liberal brand is no longer electable in Canada, and the sooner that Canadians wake up to that reality, and get our head out of the sands, the sooner we can create an alternative party that will truly offer alternative policies in an alternative government.  Right now, there is no real alternative, and, let's face it, the Conservatives are benefiting big time.  Their biggest asset is none other than Michael Ignatieff.  At a time when the alternative part should be soaring in the polls, and chomping at the bit for an election, instead the alternative party is lagging and languishing, and going nowhere but down, down, down into oblivion.  Folks, let's face the facts,  A new leader for the Liberal party is essential.  The old leader is the best asset that the Conservatives have, and that is a shame for Canadians."CommentKey:80fcc533-fc01-4f23-a055-38cfc4192a4c	2000415568	Sat Feb 12 2011 16:40:13 GMT-0500 (EST)	demonal	10	"harper hosts an international summit to show canadians and the world, he is a bona fide international figure head....  harper's  last comments on egypt was feb 4 or 5 when he spoke to obama, i recall he also had nothing to say in early dec. when british pm cameron announced his troop withdrawl from afghanistan to start in 2011...  he always goes into hiding for periods of time when hot button issues don't go his way, he hands 5 billion dollars to the u.s. in the softwood lumber dispute ( trade agreement sided with canada ) and now they come clamoring for more and where is he?  is this the kind of leadership we want canada?"CommentKey:921a2a65-f9c2-4ce0-b718-2b3062c3d752	2000415568	Sat Feb 12 2011 16:40:13 GMT-0500 (EST)	uranusmile	13	"RomeoCostello wrote:Posted 2011/02/12 at 4:04 PM ETExplain to me how you can give a thumbs down to the fact that Harper has created a $56,000,000,000.00 deficit and this is somehow a good thing and a reason to vote for him?  -------------------  Do you mean to say that Stephen Harper and the Conservative government created the global recession or that you wish, as did the Liberals and NDP at the time, that the deficit spending to help Canadians out should have been $70B, $80B or more?  You do remember that all of the G20 countries agreed that deficit spending was the way to go in order to get the planet out of the global recession don't you?  Perhaps you just have selective memory and like taking items out of context to make a foolish point expecting that everyone will look at you like you are some kind of a brainiac?  Guess what."CommentKey:4025bbb4-d240-4544-bf59-f7f4d371a28f	2000415568	Sat Feb 12 2011 16:41:34 GMT-0500 (EST)	Canman05	10	"RomeoCostello wrote ""wow, the number of trolls is sad and sickening.   do you Con Employees get a T4 or Cash?""  Of course anyone who disagrees with you must be paid right?  There is no possible way anyone else could just happen to disagree with your opinion, afterall you are perfect right?    Maybe the reason the libs are so low in the polls is party due to the HUGE EGO you seem to have.  An ego that is totally unearned and undeserved.    Check your ego and check in with the Canadian people."CommentKey:786534c4-6441-4c72-ac96-ea64aa0c60f5	2000415568	Sat Feb 12 2011 16:41:47 GMT-0500 (EST)	A.Tang	5	"It's been said before, and probably is worth stating again:  Harper plays political chess while the opposition is playing political checkers.  It's not even a complicated tactic, it's just a 'fake-out' after all.  You know the action of feigning to go one direction then take the other?  It's not exactly Harper's fault that his opposition continually takes the bait hook line and sinker.  What essentially has happened is that the public perception is that his opposition is a lot of hot-air and almost no substance.  While it can be said that the Conservatives are full of hot-air as well, but at least they actually have gotten things accomplished, and done so under a minority government (The longest running one in Canadian history if I'm not mistaken)    The reality of the situation is this:  While the Conservatives have a minority, none of the opposition offers anything of substance.  The combined opposition could force elections whenever they damn well wanted, but to do so would only result the same election results anyways.  The other reality of the situation is that whoever pulls the election trigger when there isn't public discontent is going to take the blame for initiating another election and will probably loose supporters.  For the lack of a better analogy, it's Cold War politics."CommentKey:8ccbd26b-73b9-47cb-bf56-eee5483c4d6d	2000415568	Sat Feb 12 2011 16:42:33 GMT-0500 (EST)	FactNotFallacy2	10	"Lefties hate democracy. nwo-never  ""Lefties"" invented modern democracy. Conservatives and landed gentry opposed any move to give a voice to the people."CommentKey:827a5ac7-d225-4386-b79e-96ddc7199b1e	2000415568	Sat Feb 12 2011 16:42:58 GMT-0500 (EST)	WhatTheHeck22	10	Kinda expected when the extent of the liberal platform is to kiss babies with a funny look on your face.CommentKey:5f3bcf3d-cef6-4653-bef5-edc16a193635	2000415568	Sat Feb 12 2011 16:43:46 GMT-0500 (EST)	Mr_Miyagi	9	"I have been watching a lot of question period in the HoC lately and the Liberals, BLOC and NDP can't go after government policy so they go after the people <><><><><><><><>  Just like Harper's shameless attack ads go figure."CommentKey:5d23dfcd-98f6-4732-974d-f7937e13d0c0	2000415568	Sat Feb 12 2011 16:44:52 GMT-0500 (EST)	Sarcastic_1	3	"it's time that the Liberals on behalf of the people take some serious soul and leader searching.. at this point all this neo-con party can hope for is another minority government.. come on Liberals..go for the gusto..you do have talent in your midst.. how about amalgamating the 4 opposition parties in to 1 AT OMCE...on behalf of  the real Canadian people who are sick and tired of the Canadian ""Republican"" Party? I realize that the Conservative hacks love to live in the past...OK lets appease them..send 'em back to the rocks they climbed out from under.."CommentKey:5253ed78-d2bf-4391-b6d1-adc09b28e5d0	2000415568	Sat Feb 12 2011 16:46:07 GMT-0500 (EST)	bgGruff	5	"Conservative Finance Minister Flaherty stated during his private  ""action plan"" press conference that ""Canada has the lowest debt ratio among g8 countries..and ""the deficit will be balanced by 2015""  heh.. if anything..Mr Flaherty is consistant..he has never been accurate or  true in his financial assessments or plans yet..never.. yet..Mr Flaherty came into office with an open mind..or no mind..? Mr Flaherty had hoped for more financial tutoring from Mr Martin.."CommentKey:97b8066c-8a19-4a80-b292-88d5b636b893	2000415568	Sat Feb 12 2011 16:48:04 GMT-0500 (EST)	Longstreet	8	"Explain to me how you can give a thumbs down to the fact that Harper has created a $56,000,000,000.00 deficit and this is somehow a good thing and a reason to vote for him?  RomeoCostello: the $56B deficit is a cyclical deficit and is the result of stimulus spending and the effects of the global recession. Do you honestly think the Liberals or NDP would've governed over a smaller deficit? Given the Liberal and NDP policy on stimulus spending, it would've been a lot greater. Canada does not have a structural deficit (or a very small one in either case) because our deficit is cyclical. Please look up the difference between the two.   ""Only Stephen Harper hates this idea. Why does Stephen Harper hate democracy?""  RobMax: are you saying that you prefer proportional representation instead of first past the post? First past the post is still democracy. Proportional representation is one of those ideas that sounds good, but is really terrible in the end. I don't want to have an election every 3 months and be governed by never ending series of coalitions. The only reason why smaller parties advocate PR is because they want to get into power and not out of some virtuous notion of representing the people. It's political opportunism at it's worst."