Comment ID	Article ID	Date	Name	Recommendation Count	BodyCommentKey:4b52142e-9967-465a-8031-e81f2e2049a6	2000415568	Fri Feb 11 2011 17:08:54 GMT-0500 (EST)	pj4nier	38	Now Harper will do all he can to provoke an election and all the while he will blame the opposition for forcing one on us.  I pray that 37% of Canadians recognize what a manipulative and deceitful man Harper is - but only the day after he calls the election.CommentKey:4a622dea-3d09-4ce6-8dcd-093889e06ebe	2000415568	Fri Feb 11 2011 17:13:40 GMT-0500 (EST)	NorthernThunder	108	"If the Conservatives are so unpopular, why do they always come out on top of these polls?"CommentKey:e710fcda-b123-45a6-ba8d-c61a937e0200	2000415568	Fri Feb 11 2011 17:15:29 GMT-0500 (EST)	backdoor	64	This is so hard to believe ...The crap that is going on with this government ..What are Canadians thinking .CommentKey:78a1852f-5129-40d7-b8d6-fb43b1d54ceb	2000415568	Fri Feb 11 2011 17:15:36 GMT-0500 (EST)	ardybob	55	Interesting!CommentKey:0d6a82cf-4731-4fe8-9b8e-ec0f9d719a90	2000415568	Fri Feb 11 2011 17:15:57 GMT-0500 (EST)	Coswrd	10	It is time for a new political party in Canada to replace the aging broken Liberal Party. The Liberals spend their time trying to woo voters from the NDP while trying to hold onto the center right voters. It just is not possible for this to succeed and Canada deserves better choice than choosing their center left party from the NDP and the Liberals. The NDP will never see power and the Liberals are fading fast. Time to create a new party that effectively swallows these two and can ensure Canadians that a Con majority will remain a dream.CommentKey:5c690957-2d57-4962-a77b-990d3892eaac	2000415568	Fri Feb 11 2011 17:18:39 GMT-0500 (EST)	Micnic	94	"Amazing!  Despite all that Harper has lied about, seems he has succesfully fooled a lot of people!"CommentKey:ab98d149-460f-4193-a8f6-21dd429fedba	2000415568	Fri Feb 11 2011 17:21:10 GMT-0500 (EST)	j_andrew23	51	"The Conservatives are so corrupt, even the polling is corrupt."CommentKey:c762216d-e4db-484a-9f61-dda7a482e2aa	2000415568	Fri Feb 11 2011 17:22:37 GMT-0500 (EST)	TTTTTT	16	I give up.....CommentKey:490ce106-0d04-449b-99fb-238b07498929	2000415568	Fri Feb 11 2011 17:22:40 GMT-0500 (EST)	undermedia	31	"Anyone else wanna bet the Conservatives will be swiftly changing their ""unnecessary/irresponsible election"" tune in light of this?"CommentKey:d8344216-852e-42c5-a726-35ce0116f8e3	2000415568	Fri Feb 11 2011 17:25:09 GMT-0500 (EST)	Ragtime	67	The lefties interpretation of this will be priceless! Bring it on I need some high level stimulation. You know from the intellectuals.CommentKey:b251f01f-2936-41fb-98c3-491a079f770a	2000415568	Fri Feb 11 2011 17:28:15 GMT-0500 (EST)	Susan L	36	"The polls out of writ are about as credible as the horoscopes.  Lest we forget, the out of writ polls are also the ones that told us Kim Campbell would be our next PM in 1993."CommentKey:2e84f1c3-fe23-4a00-b0fd-cb887b2eaf63	2000415568	Fri Feb 11 2011 17:28:17 GMT-0500 (EST)	pittsky	72	Election please.  A Conservative majority is what this country needs.CommentKey:eea8c645-a634-4725-befe-119caafdcf4c	2000415568	Fri Feb 11 2011 17:28:51 GMT-0500 (EST)	Aprobrius	21	"Egypt has forced an evil regime from power and we must do the same.  Ekos poll or Harris Decima that, when a co-alized group of patriots restores Democracy and honesty to Canadian government."CommentKey:47e07af1-033a-4607-a930-2b591fb468c4	2000415568	Fri Feb 11 2011 17:29:01 GMT-0500 (EST)	CommonersSay	69	This Conservative gov't may not be all things to all people but Canadians are realizing that they provide competent and scandal free governing; that's a minimum that Canadians expect and had not received from successive Liberal gov'ts.CommentKey:9c118340-46ea-4721-b2cf-7cc8a1b1cbc2	2000415568	Fri Feb 11 2011 17:30:01 GMT-0500 (EST)	dgordon	54	"Nice News,   Thanks Frank"CommentKey:8c338a32-d80a-4596-926e-071100baee96	2000415568	Fri Feb 11 2011 17:30:06 GMT-0500 (EST)	Starboard is for the governor	44	"I can hardly wait for an election so P.M. Harper can get the majority we Canadians need and deserve for our government to make the decisions required to rein in our deficit and to deal with criminals, illegal immigrants, traitors and a host of issues that cannot be dealt with by a minority government. We need to protect our economy from the ""tax and spend' Liberals and their adscam friends."CommentKey:351c9da4-589c-46fb-8b75-83b6bb675753	2000415568	Fri Feb 11 2011 17:32:31 GMT-0500 (EST)	bgGruff	24	if it acts looks and sniffs like a wannabe dictatorship it probably is.. how is it that Canadians tolerate a minority government that muzzles  federal watchdogs..dissolves Parliament to avoid a confidence vote.. has the tightest grip on the nations news press ever..controls the RCMP through the PMO appointed commissioner..tells canadians what they are concerned about..and not concerned about..has racked up the  biggest Canadian deficit on record..and is not about to slow down on  discretionary spending.. don't ever give this man a majority mandate..he will tell canadians they  don't need opposition parties..aren't interested in elections..and that parliament is a waste of time and money..Mr Harper obviously thinks  so..CommentKey:0ef78ca5-0ee9-48cc-9d9a-f3406cf89e46	2000415568	Fri Feb 11 2011 17:35:05 GMT-0500 (EST)	dgordon	22	With these numbers the seat count may be in majority territory already  Lets see another  poll  first to compareCommentKey:921a5413-e7a2-4165-b31b-4ce403e02e45	2000415568	Fri Feb 11 2011 17:36:13 GMT-0500 (EST)	censoredone	42	"No big surprise here that the CBC tried to bury their Liberal polster with this type of news. My word little Iggy's red sweater getting messy again, oh the horror.Where is the CBC blogging princess with her analysis? .....I got it bad news in the poll for the Liberals and the CBC doesn't say a word and buries the news story a day later and on a Friday. Nice!! What is next the CBC blocking access to information requests?"CommentKey:21089923-f95b-4164-bcee-0c2fca6c4c2a	2000415568	Fri Feb 11 2011 17:38:19 GMT-0500 (EST)	Marie Rivera	12	"Okay, Now lets look for the real polls on election day. There is where it will show the real results.In an actual campaigne Ignatieff will have a chance to announce to all of Canada his polices and platform and his ability to answer the media honestly because its plain to see that they currently are not and I am talking about the CBC as well.  The media sure isin't  giving hiom fair air time or coverage.Evans can't stop himself from interuppting and is a poor choice to host Power & Plolitics.   Mr Ignatieff has been holding town hall meetings actually meeting the average Canadian. Anwering all questiuons without prompts and Canadians can tell  truth from propaganda and will make Stevie look like an idiot and how very much out of hthe league he really is in."CommentKey:d06b7e91-4aa1-4ab0-9153-6a926afd6d98	2000415568	Fri Feb 11 2011 17:38:21 GMT-0500 (EST)	Ali Oop	11	"Roughly 1/3 of Canadians on the right still dictate to the 2/3 of Canadians left of center.  I'd rather see a coalition than Harper continue to erode what is decent about Canada and take us down the road of more prisons (when crime is declining), corporate tax cuts while cutting services, and more war machinery.    Just be glad we won't see the true agenda he would bring out with a majority!"CommentKey:0d36a434-285f-4342-9571-97e164c5097c	2000415568	Fri Feb 11 2011 17:41:34 GMT-0500 (EST)	MatthewMcCabe	11	"It seems the Canadian public fails to grasp the fact that the Conservative Party acts only in the interest of corporations.  If they did their research and looked at more objective news sources(such as the BBC, Al Jazeera, etc) they would come to this conclusion on their own."CommentKey:1071558b-5fb5-4c87-a50e-47b8d74c1052	2000415568	Fri Feb 11 2011 17:42:20 GMT-0500 (EST)	Man-O-Man	9	If this poll is actually true then we are in deep deep trouble in this country.  Stephen Harper may in fact get his wish for a 2 party system which I believe is bad for democracy but will ultimatley ensure that conservatives will become a permanent opposition party like the BQ.CommentKey:a48fa63a-01a5-4128-ba1d-4abd9b663d38	2000415568	Fri Feb 11 2011 17:43:24 GMT-0500 (EST)	duffyks	44	Am willing to bet that there will be a flu epidemic in the opposition pary when the time to vote for the budget arrives?CommentKey:084aa01b-d041-41c0-a31f-d5505cfe5f75	2000415568	Fri Feb 11 2011 17:44:49 GMT-0500 (EST)	IPSCMP40	49	"Opposition fortunes have taken a decidedly downward pitch since they started talking election, the EKOS report said.  ""The Liberals and the NDP... might want to consider an urgent rethink of their preliminary election framing, or perhaps even the idea of an election at all.""  ~~~~~~~~~~~~~~~~~~~~~~~~~~~ I am for an election, which will bring about a majority Conservative Gov't"CommentKey:bf77ae68-3838-4ffa-bda7-ca92c55d67c7	2000415568	Fri Feb 11 2011 17:45:33 GMT-0500 (EST)	dumlibs12345	44	lo lol lol lol  I knew it that's why they took so long to release this one. The CBC waited till Friday in hopes no one would see it!CommentKey:a618583c-5eff-4a77-b6d8-61c2a2f90733	2000415568	Fri Feb 11 2011 17:46:15 GMT-0500 (EST)	Settler1920	36	"Gut check time for the Grits, but no guts!"CommentKey:f845edea-fd78-45e5-a5c8-0a80bf016a02	2000415568	Fri Feb 11 2011 17:48:40 GMT-0500 (EST)	Maxx 1964	19	I will never vote Conservative.  Lets have a Spring Election and Prove These Pollsters were Wrong.  The Youth of Canada will never vote for the Hypocrite called Harper.CommentKey:cc88b9bf-0478-4780-a956-beaff77a9f54	2000415568	Fri Feb 11 2011 17:48:49 GMT-0500 (EST)	DJ1951	33	"We see Dalton putting the breaks on his programs in Ontario in an effort to stop the bleeding by the Liberals in Ontario AND we see the Liberals bleeding support federally to the point where one wonders what these guys are thinking.  I personally believe that the Federal Liberals live in a dream world.   Canadians (other than some of you on this forum) do not want IGGY, do not want an election and will turf the Liberals out everywhere if they are not careful.    So to our Liberal friends...you may be ready for an election campaign but I doubt if you are ready for the results...the destruction of the Liberal Party of Canada."CommentKey:282e2a9c-cbe6-4305-92c2-789361abc3a3	2000415568	Fri Feb 11 2011 17:49:24 GMT-0500 (EST)	ScottyG	32	"Sorry, I was going to post a minute ago, but I had to stop laughing first. -- Iggy has been so over the top, so full of it, so out of touch, I think some times I am watching the Gong Show. -- Really, Forget the Failed liberal policy, lets just laugh at the eye brows and yellow teeth, and the Big mouth attitude he has. -- Next time Liberals, don't import your leader and think a bit more before you get some guy like Bob RAE to work for you.   -- So now that you know your a lost cause, can we get you to tone it down, pass the budget and let things carry on already."CommentKey:a876fc72-a5fa-48c6-96fb-93c32275c5b3	2000415568	Fri Feb 11 2011 17:49:42 GMT-0500 (EST)	libsrtoast	37	lo lol  Good bye Iggy!!!!!!!   I knew something was up when the CBC didn't release this on Thursday.  Franky the Liberals Graves must be getting an earful from LPC head quarters. Looks like no spring election however there will be a lot of back side kissing in the house this spring. Harper shouuld start governing like he has a majority.  Cry you leftoids CRYCommentKey:c4229b1b-3e75-4168-a2c3-15708b6ab014	2000415568	Fri Feb 11 2011 17:49:59 GMT-0500 (EST)	Aulden Gray	21	God help our country.CommentKey:335e5875-7fc5-42eb-85c4-1c7f1a383c20	2000415568	Fri Feb 11 2011 17:50:54 GMT-0500 (EST)	dgordon	43	"come on CBC, you gotta make this front page news sometime. I know it hurts"CommentKey:fa9afef8-2337-4905-bf53-64de95e7fbc5	2000415568	Fri Feb 11 2011 17:53:17 GMT-0500 (EST)	Inter Refugee	37	Calling Iggy ! Calling Iggy ! Bus for Harvard departing !  All your experience with bus tours should now come in handy !CommentKey:d4713a62-1e68-4176-8a0a-e15b0026ccdd	2000415568	Fri Feb 11 2011 17:53:31 GMT-0500 (EST)	Kkppmm33	17	How this Government continues to lead the polls is beyond me!CommentKey:3b94dc1e-3856-433a-9275-f5fbcbc06ff4	2000415568	Fri Feb 11 2011 17:53:34 GMT-0500 (EST)	libsrtoast	34	lol  Iggy is sucking worse than Dion.  lol  Only a few more months left in the history of the LPC.  When they fold what will Toronto do?CommentKey:92b1dcdf-e17d-4466-85e6-b1f1c4fe6205	2000415568	Fri Feb 11 2011 17:53:58 GMT-0500 (EST)	Martin in ottawa	12	"Well, now it appears to be official. I always knew that the majority of Harper supporters were pretty dim, but it is now confirmed that almost 40% of all Canadians are similarly dim. Unbelievable - very poor economic management(record deficit, massive growth of government) complete lack of transpartency, outright lying to the public - with a straight face - doctoring documents, firing those who dare to disagree or who believe in facts.... you name it. these clowns appear to get away with it all. Our national embarrassment seems destined to continue for some time. Sigh."CommentKey:1026d3f5-cc87-425d-b0b7-11eac953a909	2000415568	Fri Feb 11 2011 17:54:37 GMT-0500 (EST)	patio888	19	"Steve Harper and his Con government do not deserve a second mandate, even as a minority government. Too much underhanded actions from these dull thuds."CommentKey:1036fc18-a506-4292-b68d-802e111e873d	2000415568	Fri Feb 11 2011 17:55:45 GMT-0500 (EST)	civicboy	8	If polling had any direct relation to our electoral process....people might care...but it doesn't...so the only people that pay much attention to these are politicians and their direct supporters  I couldn't care less about the weekly play-by-play polling analysis that all the pundits participate in...it doesn't mean much at all.CommentKey:0bbd52c1-5186-4628-a2ed-1a96e770a7ab	2000415568	Fri Feb 11 2011 17:56:47 GMT-0500 (EST)	Iceman6802	23	"Oh gee, back to the drawing board liberals. Your protest a day strategy isn't working. Maybe get rid of the daily Bob Rae foreign briefings(aimed at getting him a seat at the UN some day-what a goof) and stop flipping on gun control, taxes, and crime bills. Your passing of a transgendered bill yesterday didn't help Mr. Ignatieff."CommentKey:014a28e1-028b-4047-befc-75e794ad2f47	2000415568	Fri Feb 11 2011 17:57:50 GMT-0500 (EST)	Leftard	19	"People don't buy the lieberal kool-aid.  Conservative majority! The only problem is, is that the conservatives feel like liberals :("CommentKey:81b31ec7-20df-47df-ad78-5b532e3a53ca	2000415568	Fri Feb 11 2011 17:58:03 GMT-0500 (EST)	Arctic Dude	11	"Harper can cheat, lie, steal and openly act Republican and the Liberals still go down in the polls. Why can't Iggy take a hint."CommentKey:259e8542-3178-4e61-a775-f6ae1ee96e55	2000415568	Fri Feb 11 2011 17:59:07 GMT-0500 (EST)	Con Crusader	28	"You lefties can go jump in the ocean now, this is MAJORITY territory! Thank God for Michael Ignatieff. Everybody is going to vote Conservative. Canada will soon be ours!"CommentKey:6b2412bf-988b-4c9a-b8a6-059c04a875a6	2000415568	Fri Feb 11 2011 17:59:58 GMT-0500 (EST)	RichardProvencher	23	"Come on Mr. Ignatieff and Mr. Layton, join with the Bloc and defeat the government and let's have an election to clear the air. You have danced and salivated too long these past years about doing this or that, then change your minds, again and again. Stop your fumbling and tumbling and call it. Us seniors will give the Conservatives a majority that will scare the pants off you."CommentKey:be375240-1b6b-47d8-826c-df3e76db96bf	2000415568	Fri Feb 11 2011 18:00:12 GMT-0500 (EST)	bruce in london	26	"Iggy,keep on promoting a National day care scheme.Keep on opposing tough on crime legislation.Keep on opposing changes to our immigration rules.Keep on recommending higher taxes for our businesses, Our govt. is on the right track on all major issues.Go Stephen Go!!"CommentKey:1d2cdfc0-2cbb-417e-b36a-a19ed2e23f8b	2000415568	Fri Feb 11 2011 18:02:42 GMT-0500 (EST)	Peter1a	9	"Ekos has really lost the plot.  All other posters are calling it way, way closer. Seems Graves has sold out to the CPC"CommentKey:0210dc10-f53b-4e3f-9f04-95d1dea09bd7	2000415568	Fri Feb 11 2011 18:03:54 GMT-0500 (EST)	FranksAndBeans	14	"Okay I'll start it off.  So..... 37.5 people said they would have the Conservatives in charge over everyone else.  Now let all pull out their calculators and say 62.5 percent dont want them...........  To that I might as well counter now, just like always its the total for votes for one party that matters not a collection of all the others.  Whew, I am done I think I covered it all."CommentKey:84ca55cf-0438-4214-99d0-9d1951453961	2000415568	Fri Feb 11 2011 18:04:18 GMT-0500 (EST)	man4change	8	"Canada needs a Liberal majority government. I can't believe that after all the scandals, lies, backroom agendas and deception how anyone would consider re-electing this backward regime. I am optimistic that voters will come around and defeat the Tories before what's left of Canada disappears. Ekos is known for its pro-conservative slant."CommentKey:1a7fa174-d18d-406c-8ac6-875c9d3904ea	2000415568	Fri Feb 11 2011 18:05:01 GMT-0500 (EST)	Buchoman	6	"The Tories’ recent success can be largely attributed to their keen ability to distinguish between Sound Politics versus Sound Public Policy. In recent months, our government has (successfully) capitalized on numerous “Wedge Issues” (positions that 2% love, 2% hate, and 96% are ambivalent to).  Prime examples include the sudden cancelation of the Long Form Census, and today’s Burka Ban Bill.  In both cases our government took positions that, objectively speaking, have no merit whatsoever from a public policy standpoint, but resonate very well among nativists and other segments of the voting public.  There are still several “Wedge Issues” that our government has not yet fully harvested, and I wouldn’t be surprised if, over the months to come, Canadians become engaged in feisty debates over upcoming government bills relating to Capital Punishment, Abortion, Gay-related issues, and Immigration Reform."CommentKey:4c4d78aa-f30c-4b63-8ee0-27470eb2eb36	2000415568	Fri Feb 11 2011 18:05:42 GMT-0500 (EST)	Joannie04	27	"WHAT??? This not on the front page? Strange, n'est-ce pas? If the results were reversed this would be the top story!!! Good news though.   And Frank continues to advise to the Liberals: ""The Liberals and the NDP... might want to consider an urgent rethink of their preliminary election framing, or perhaps even the idea of an election at all."" Ya think???? They also might want an ""urgent rethink"" of Michael Ignatieff. However, he works for me!! Let's keep the status quo!! Things look good this way!"CommentKey:a2744e57-0222-4d49-ab01-9349fbe8b2d9	2000415568	Fri Feb 11 2011 18:06:40 GMT-0500 (EST)	Norman	9	"If  we are ever able to rid ourselves of this conservative scourge, we may have to take a page from the Egyptian handbook."CommentKey:a54999d3-760e-4f7a-8160-699943c4078d	2000415568	Fri Feb 11 2011 18:09:25 GMT-0500 (EST)	daveyconnauton	27	I love how the bad news for the LPC is released at 6:00 EST on a Friday.CommentKey:192d8df4-9d4d-4e58-adb4-c3a492bfdfd5	2000415568	Fri Feb 11 2011 18:09:26 GMT-0500 (EST)	parnel	7	I frankly don't believe those numbers are a true picture of how Canadians feel. Harper has been getting very negative press recently and talk of an election has also come from his party.CommentKey:4121bdfc-56fa-4c45-ab15-407e93117d6c	2000415568	Fri Feb 11 2011 18:13:54 GMT-0500 (EST)	TroyDavidson	8	I'm not sure I buy Mr. Graves poll.  Other polls show the Conservatives dropping in support over the past month.  There is no other poll that has the Conservatives at 37% and the Liberals at only 24% or the NDP at only 14%.  It looks like a bit of a rogue poll to me.CommentKey:743a3db2-d830-446c-b481-5b09e19d0812	2000415568	Fri Feb 11 2011 18:17:21 GMT-0500 (EST)	Ottawa#1	16	"All I have to say to this is   LMAO Liberals!  The lead will most likely fall by the next poll in 2 weeks, but this is just great!  Whether this is one poll or not, I can't remember seeing these kinds of numbers in an EKOS poll for some time and so this should be troubling to not just the Liberals, but the entire opposition (except maybe the Greens, who might just win their first seat!  They did in the UK with 1% of the vote =P)  Come on opposition, bring down the government, I dare ya!  ""Oh those big meannie, corporate toady, bible worshipping, oil drinking for breakast, little puppy-eating, kitten-stomping, prisoner-guillotining, republican thugs in the Harper government are leading in the polls!  Ba-Humbug, they still have 63% of people against them""  The above is my predicted opposition response to this poll, until next time! Don't worry Liberals, we'll always have 34% in the polls.  -Signed university student who can't wait to help volunteer in the election that'll bring in a Tory majority"CommentKey:84e17c06-0e6d-4ccd-b18a-8553ba843ff9	2000415568	Fri Feb 11 2011 18:17:37 GMT-0500 (EST)	JackABC	6	this is strangeCommentKey:d8f19413-2e55-4ca4-921b-781544cbcef2	2000415568	Fri Feb 11 2011 18:17:52 GMT-0500 (EST)	William J. Godfrey	6	"Simply, I do not believe this Poll!  It is not what have been observing on the social networks."CommentKey:54ae1c68-c3cc-42f0-9f97-ba28c6fd8c3d	2000415568	Fri Feb 11 2011 18:21:39 GMT-0500 (EST)	gswaters	12	"One poll is but a snapshot, but the trendline is positive for the Tories. Watch for the election fire to sputter and dwindle in the Libs and NDP and for some sort of compromise to develop over the Budget."CommentKey:9110cb61-9ea0-4163-8abf-a5225f428524	2000415568	Fri Feb 11 2011 18:21:47 GMT-0500 (EST)	Spruce	18	I'm glad this poll has finally been released. It's looking more likely that Canadians will be heading to the polls this spring and a Conservative majority government will be the likely result.CommentKey:2d5f2209-a3ae-461e-a01a-81b81f9ea5f0	2000415568	Fri Feb 11 2011 18:21:56 GMT-0500 (EST)	Lost Liberal	13	I guess Iggy will be saying NO NO NO.CommentKey:8730d02e-3153-4fbc-98d5-5689cb1afa2f	2000415568	Fri Feb 11 2011 18:23:09 GMT-0500 (EST)	Susan L	5	"The Liberals and the NDP... might want to consider an urgent rethink of their preliminary election framing, or perhaps even the idea of an election at all.    Uh-huh.....cause the out of writ polls are so accurate? I have some doubts about the veracity of this document"CommentKey:c9be7f71-a823-4bbb-9d30-37193157d7e0	2000415568	Fri Feb 11 2011 18:24:20 GMT-0500 (EST)	Con Crusader	11	"This is so hilarious. Everyone on here is so outraged over altered documents and all the other rubbish they throw at the Conservatives, but in reality nobody cares. You lefties are blogging furiously, but the coming majority is being won in Canadians' hearts. We're praying, passing the plate at church and knocking on doors while you blog aimlessly to the choir and fight amongst all the leftist parties. Face it, with the Tories being assimilated by Reformers, Stephen Harper is invincible, and Canada is about to see what he meant by unrecognizable ""change"". It doesn't matter how many scandals the lamestream media digs up because people trust our government more than Liberals. Think of the polls after Sun News goes live! No more incremental pandering to pacify a whining opposition. What a great day to be a supporter of Stephen Harper's Conservatives. Thanks Iggy."CommentKey:f8bc0987-1fa8-4a61-b726-b3ab838790cd	2000415568	Fri Feb 11 2011 18:24:54 GMT-0500 (EST)	JLB 68	11	"This poll shows that Canadians understand which party is best suited to govern this country.  The Liberals had had decades to live up to its promises (and potential). JeanChretien blatantly lied when he promised to repeal the GST before taking office in 1994, and Paul Martin was arrogant regarding use of EI surpluses.   PM Harper has made mistakes, and he's not a particularly inspiring or charismatic figure. However, he has shown a real understanding of what the economy needs."CommentKey:6cf40bee-9ec6-449d-8e73-d2253f4ff95a	2000415568	Fri Feb 11 2011 18:25:38 GMT-0500 (EST)	ahappytoon	3	i hope iggy brings his harvard teachings to us poor canadians because were too stupid to think for our selves and we neeeeed his help in telling us on how to live like the usa . its  iggy or im gona vote fur jack the talliban hugger lol lol lol 'CommentKey:c48921a9-ae38-4964-a7ab-28eae4130197	2000415568	Fri Feb 11 2011 18:25:44 GMT-0500 (EST)	T2Steve	7	"*** Please note, Poll taken before the Oda debacle from earlier today ***  I don't think it matters anymore. The electorate has become so detatched that they don't even notice the continual scandals that Harper's gov't provides on a seemingly day to day basis.   I miss the days where the ministry of health was one of the most important. When we would hold an election to let Canadians decide what to do with our Federal Surplus. When we would be outraged to find out that the population was lied to.  I think if the question was asked ""Do you trust or believe that the Harper Government is being fully honest and accountable?""  the result would be much, much lower.  Paul Martin would school the Cons in an election today. Iggy might, but we will never know because he won't ever be around when an election is called. He's had a lot of negative put down on him, but I'm reserving my judgement for when we actually get to know anything about the man from his own account, rather than that of an attack ad.  BTW, doesn't anyone else think that it's ironic that the Conservative government finds anyone to be ""too American""? I mean, most Canadians find the current Con breed to be Too Republican.   I miss Joe Clarke."CommentKey:1151c4ac-f6d1-43be-8b65-ca6f2bdc15c8	2000415568	Fri Feb 11 2011 18:25:53 GMT-0500 (EST)	mike.fisher	12	Go Tories!