Comment ID	Article ID	Date	Name	Recommendation Count	Body
CommentKey:558518f4-b81d-4459-b901-2d8980deb42e	2000415835	Mon Feb 14 2011 08:26:54 GMT-0500 (EST)	Alex Vega	3	3 weeks of irritating news on a tin-pot dictatorship. That is still a dictatorship. Way to go!!! The western media helped you achieve nothing. It was a bit of a distraction for Julian, he was supposed to be hogging the headlines.
CommentKey:814abe29-7138-4b1a-b819-c1b7d52db215	2000415835	Mon Feb 14 2011 08:33:52 GMT-0500 (EST)	logicman1	2	"Happily it's the Canadian way to let elections change our leaders."  - What pipe dream have you been living? nearly 40% of the Canadian electorate didn't vote last Federal election!   The number of people who vote has nothing to do with the fact that we change our leaders through elections. Perhaps you could explain how you think we change leaders. -----------------------------------------------------------------------------------------------------------------  How did this story become a discussion about Canadian Politics?  But since you brought it up, let me explain:  Wh had two "right wing" parties, neither of which had any chance of winning an election at the time.  They then get together and form a coalition of "right wing" followers.  (we had NO say in that)  Then they decide among them as to who will be their leader (We had NO say in that)  We have a general election where the majority of canadians Did NOT vote for this "right wing" coalition. (we DID have a say in this, but it didn't work)  So, here we are being governed by s person who is supported by large coorporations and seems to have "dictator" style leadership!  Under this, large coorporation sponsered, type of government where the rich get richer and the poor get poorer (which is happening right now) We will soon be in a similar situation where the top minority have all the wealth and the rest of us will not be  much better off than they are!
CommentKey:a4c40ae9-44e4-4bb5-9fc7-ac6b9212fceb	2000415835	Mon Feb 14 2011 08:38:30 GMT-0500 (EST)	Loose Cannon	11	Promises are made to be broken. Power corrupts.
CommentKey:3cc38eb9-cbb9-46e4-989b-65393e4d5d71	2000415835	Mon Feb 14 2011 08:41:56 GMT-0500 (EST)	wwwang	20	Your Mothers Britches wrote: " What pipe dream have you been living? nearly 40% of the Canadian electorate didn't vote last Federal election!" --------------------------   And yet by most estimates the crowd of protesters was only 250,000 - 350,000 or less than .003% of Egypts population
CommentKey:64054e69-4a4e-4309-ba64-abeb9bfbe7d2	2000415835	Mon Feb 14 2011 08:45:58 GMT-0500 (EST)	historyone0one	3	A military secular states is as good as it gets in muslim dominated countries.   Jemaah Islamiyah appears to be similar to Muslim Brotherhood.  Indonesia cleric on 'terror trial'   "In recent weeks, hardliners also have stepped up attacks on Christians and minority sect members.  Despite no significant terror attacks in Indonesia for nearly two years, security in the capital is pervasive, with checkpoints placed at the entrance of all major shopping malls, hotels, embassies and government buildings.  Shadowy movement  The 72-year-old Bashir, is officially the caretaker of an Islamic boarding school on Java island but has long been considered the spiritual leader of the shadowy Jemaah Islamiyah movement, which seeks to establish a Muslim caliphate across Southeast Asia."   Okay, so to prevent "significant" religious attacks there has to be "checkpoints placed at the entrance of all major shopping malls, hotels, embassies and government buildings.   No reasoning with religious nuts.
CommentKey:d07761c1-24ed-48a9-bd62-535a6e2f700a	2000415835	Mon Feb 14 2011 08:46:32 GMT-0500 (EST)	historyone0one	6	A military secular states is as good as it gets in muslim dominated countries.   Jemaah Islamiyah appears to be similar to Muslim Brotherhood.  Indonesia cleric on 'terror trial'   "In recent weeks, hardliners also have stepped up attacks on Christians and minority sect members.  Despite no significant terror attacks in Indonesia for nearly two years, security in the capital is pervasive, with checkpoints placed at the entrance of all major shopping malls, hotels, embassies and government buildings.  Shadowy movement  The 72-year-old Bashir, is officially the caretaker of an Islamic boarding school on Java island but has long been considered the spiritual leader of the shadowy Jemaah Islamiyah movement, which seeks to establish a Muslim caliphate across Southeast Asia."   Okay, so to prevent "significant" religious attacks there has to be "checkpoints placed at the entrance of all major shopping malls, hotels, embassies and government buildings.   No reasoning with religious nuts.
CommentKey:eda3bdd5-dc55-4887-bc47-eb302da349e4	2000415835	Mon Feb 14 2011 08:58:37 GMT-0500 (EST)	taxmeplz	10	Your Mothers Britches wrote: "Happily it's the Canadian way to let elections change our leaders."   - What pipe dream have you been living? nearly 40% of the Canadian electorate didn't vote last Federal election!  If Canada had any kind of political opposition worthy of governing that number wouldnt be so high would it.
CommentKey:ac88820f-457b-4ddf-9195-10cd9443a2d6	2000415835	Mon Feb 14 2011 09:00:44 GMT-0500 (EST)	norwid	3	It looks like a very bitter victory.  Nothing will ever change in the Middle East for the better as long as the religion dominates their lives.
CommentKey:6290866d-0fe3-4f85-9b85-ef038b2a100c	2000415835	Mon Feb 14 2011 09:01:43 GMT-0500 (EST)	norwid	2	It looks like a very bitter victory.  Nothing will ever change in the Middle East for the better as long as the religion dominates their lives.
CommentKey:b627f973-772a-4037-91ad-d0a06221930b	2000415835	Mon Feb 14 2011 09:02:14 GMT-0500 (EST)	YLeeWabbit	2	The moron Liberals here and their even dumber friends the CBC actually thinks these fools won their freedom, all they won is a harsher regime.  Dance monkeys dance!
CommentKey:27cd3e8c-eb46-496f-93c1-ed4ec666535e	2000415835	Mon Feb 14 2011 09:06:21 GMT-0500 (EST)	Trajan	2	Oops. So now what? Protest the military? I posted before about the severe attention-deficit disorder that plagues the entire world and our impatience for immediate results. There is not going to be any immediate results. Transition takes time. If you want to try your luck raising heck against the Army I think you'll find them a much more determined and aggressive ruler than Mubarak ever was. They ain't going anywhere. They are now in charge. No two weeks of camping out in Tahrir Square is going to get them to hop on a plane and take off for the Bahamas. I guess you're going to have to take them at their word. And be patient. Cheers.
CommentKey:cec2e37a-7aa5-4405-b7b0-e23e1ee67769	2000415835	Mon Feb 14 2011 09:06:25 GMT-0500 (EST)	KRAKATOWA	2	Listening to 'The Sunday Edition' on CBC radio yesterday, Michael Enright asked his guest,  "When was the last time a military regime handed its power back over to the people?"  The answer:   "Turkey, 1950--since then, NO military has EVER willfully handed power back to the people."  Let's hope to God the Egyptian military keeps its word.
CommentKey:92250010-c85c-4b7a-967c-e0965dc98e69	2000415835	Mon Feb 14 2011 09:07:11 GMT-0500 (EST)	davegravy	5	The protesters need to stay at all costs, until there is true democracy, even if the result is violence and a demolished economy. If they leave now the power void will be quickly filled by another authoritarian leader/group.   If they want to have any say in how things are to change going forward, they need to force that change themselves.   Think I'm wrong? Point me to a country that, under military rule, has evolved into a true democracy...
CommentKey:e4c726d9-5928-403b-88d9-71bc4437aff2	2000415835	Mon Feb 14 2011 09:08:14 GMT-0500 (EST)	unequaled	3	Ooops!  Is the party over?  Don't worry, you can still demonstrate in Toronto - Ottawa.
CommentKey:28207969-2886-4d8c-a939-95abfe0cc8a9	2000415835	Mon Feb 14 2011 09:08:19 GMT-0500 (EST)	Jack Congson	3	Famous last words:  We will only hold power till the elections!  I will still respect you in the morning......  I will call you later... I promise!  The check is in the mail.. ..I swear!
CommentKey:33a61e16-bba5-4b6f-9237-10bcb1965073	2000415835	Mon Feb 14 2011 09:12:17 GMT-0500 (EST)	Jack Congson	1	Famous last words:  We promise to hold elections in six months. I will still respect you in the morning. I will call you later... I promise. I swear the check is in the mail!
CommentKey:47e44a12-cb95-4534-b15c-f4c3ac33aa34	2000415835	Mon Feb 14 2011 09:13:03 GMT-0500 (EST)	hohumm_toronto	0	using bullhorns ?
CommentKey:8a4392e2-e6a7-4c4c-bb44-1f30f548f0ab	2000415835	Mon Feb 14 2011 09:13:59 GMT-0500 (EST)	hohumm_toronto	0	using bullhorns ?
CommentKey:1195f404-d5c8-49a6-a309-9e2b7641fed5	2000415835	Mon Feb 14 2011 09:14:43 GMT-0500 (EST)	hohumm_toronto	0	using bullhorns ?
CommentKey:d3b767e9-3474-4864-8249-e989618056d9	2000415835	Mon Feb 14 2011 09:15:13 GMT-0500 (EST)	hohumm_toronto	0	using bullhorns ?
CommentKey:654fe072-b2df-4c0b-8149-917badc6ba21	2000415835	Mon Feb 14 2011 09:16:42 GMT-0500 (EST)	KRinBC	4	wwwang wrote:  And yet by most estimates the crowd of protesters was only  250,000 - 350,000 or less than .003% of Egypts population  ---------------------  Check your work!
CommentKey:3ae7e90e-ae91-424e-b911-0ea66850de91	2000415835	Mon Feb 14 2011 09:17:47 GMT-0500 (EST)	oldguy419	1	yep............. good 'ole 3rd world democracy. The military suspends the constitution .. then re-writes it..    Meanwhile all the wee folk howl and scream in the streets.  What else can we expect from such backward countries??  However I would love to see Saudi Arabia in turmoil...
CommentKey:f5cdcd8e-d4ff-4bd5-a7bb-7b38f8a30ce8	2000415835	Mon Feb 14 2011 09:21:38 GMT-0500 (EST)	CNDGIRLOVRCs	2	For the readers information, the military is being supported by a committee of experts in the interim period. The people that are insisting on remaining in Tahrir Square are the relatives and friends of those detained during the protests and prisoners of conscience from earlier times.
CommentKey:3aa39441-e4d6-4c98-a15d-f8184d7b22cb	2000415835	Mon Feb 14 2011 09:22:41 GMT-0500 (EST)	CanadianCon	2	Canadian Viewer wrote: Posted 2011/02/14 at 7:02 AM ET "Like i said in an earlier post - from the frying pan, into the fire."  You bet. Are there any new jobs now that the protesters have had their day. No. And there won't be. But who will there be to blame now? The military? The Arab world is not known for nation building. They have no history of it or experience. The coming months will be interesting to watch things unfold there.
CommentKey:7cceca8f-cd76-4ce0-84f3-2127b992fcbb	2000415835	Mon Feb 14 2011 09:23:13 GMT-0500 (EST)	freerangeburger	8	had to laugh looking at the toronto sun on the weekend there was a picture of  a protest in toronto and there were more women in that one picture than there were in two weeks worth of pix coming out of egypt. That says just about everything you need to know about a woman`s place  in egypt..
CommentKey:69ea52a4-a188-430b-837b-77414b66fac9	2000415835	Mon Feb 14 2011 09:23:56 GMT-0500 (EST)	hohumm_toronto	0	carlos the jackal osama bin laden same ?
CommentKey:43af8d9b-3a01-4684-a7eb-803841eaadf8	2000415835	Mon Feb 14 2011 09:26:34 GMT-0500 (EST)	catapleiite	1	I always predict right; This Egyptians are getting more of the same and maybe worst than what they had before. It is the same military and same "special" police that are taking over rand will cling to power just as the previous dictators did. After they organize a "new" party of their own they will "win" the elections and stay on. Main objective was to get the crowds under control without to much visible damage and now to prevent them to raise their heads again. Prisons will fill quickly again and any show of discontent will be punished before it gets of the ground. Egypt like all the rest of the middle east countries will stay the way it always was.
CommentKey:80192d00-7a06-4c78-beb4-3043bd23f8d0	2000415835	Mon Feb 14 2011 09:28:00 GMT-0500 (EST)	Kensington Smyth, the 23rd	1	The next six months will tell how far this revolution has really gone in making the lives of Egyptians better. Right now, all I see is window dressing. It is what is going on behind the scenes that might make the positive or negative difference in regards to the nation and the region.
CommentKey:ccaa7330-cc9d-4f94-bd59-a2bc3b8cf2e6	2000415835	Mon Feb 14 2011 09:28:02 GMT-0500 (EST)	hohumm_toronto	0	that snow will be melting and freezing and melting and freezing blow up the ice jams like the rockslides and the tire fires
CommentKey:ba9901c5-e00d-4486-a95d-24c5dddfc245	2000415835	Mon Feb 14 2011 09:32:41 GMT-0500 (EST)	jcrackerjack	1	my my my How does that go  Parties over, everybody go home.... LOL LOL   Just like a spring..... In like a Lion out like a Lamb.  Was the 24/7 coverage just a bunch of super hype where every pundits on P&P and P&P  got their 15 seconds of fame to make calls their now hopping will be quickly forgotten LOL LOL  Canadians can be proud of their Government & a professional foreign service for having approached this  entire mater from the beginning second to none. As usual the babbling buffoons in the opposition benches & liberal media can hope their claims of Canada's shortfall will go unnoticed. Canadians  won't. But they can be forgiven  LOL LOL Democracy also gives them the right, to be wrong, over & over & over, time & time again. LOL Egyptians will make all calls...
CommentKey:71c069bf-738c-48b4-9139-5f88a10eb8d9	2000415835	Mon Feb 14 2011 09:34:40 GMT-0500 (EST)	WilliamOlsen	1	wwwang wrote:Posted 2011/02/14 at 8:41 AM ET "And yet by most estimates the crowd of protesters was only  250,000 - 350,000 or less than .003% of Egypts population" ============== Are you saying that US only use the views of a small percentage of population to take over the views of the vast majority of the popluation?
CommentKey:0ae185b4-9fd7-4b24-abef-87cbdc685f21	2000415835	Mon Feb 14 2011 09:36:20 GMT-0500 (EST)	bmeasho	0	This was the revolution of the new era. A revolution of new generation. A young new generation equipped with internet, facebook and twitter. And they have effectively accomplished their mission. They have overthrown the dictator. They have done it through peaceful demonstrations. They were not pushed away by   Mubaruk supporters thugs or by any fanatic religious ideas. They need to go home now and free the square. They have formed a coalition to protest every Friday and to put a pressure on the military government.  They need to put trust on the military and so far the military had done an outstanding job. The military also in the right direction in  “banning protests and strikes”. The country need to resume to a normal life. Let them amend the constitution and create good atmosphere for new government to be elected in six month.  Then it will be up to the new government to full fill the wishes of its people. If not they will be thrown out in an election.
CommentKey:9cc1151b-47ca-4906-bf8d-3a5c20d00d28	2000415835	Mon Feb 14 2011 09:45:43 GMT-0500 (EST)	FredLopp	1	Check your math, ww.
CommentKey:f2111442-ec0d-4010-b465-0fb7553a7724	2000415835	Mon Feb 14 2011 09:46:16 GMT-0500 (EST)	Passionate Canadian	2	Steve and Barak will be onside again.  The military will gradually move from one state of emergency to the next., forgetting democracy...for another 30 years.  Meanwhile, we North Americans wonder why we are so despised by those who witness our behind-the-scenes machinations to deprive others of their freedoms.  And all the while we plant the seeds of the grapes of wrath, as Steinbeck called it.  We reap what we sow.
CommentKey:4247270d-c3a1-4090-924c-bc7c4641600d	2000415835	Mon Feb 14 2011 09:46:38 GMT-0500 (EST)	spreadnolies	4	J-Practical states: "Happily it's the Canadian way to let elections change our leaders. That way our army can do their real job, because our democratic processes do theirs'."  ****************************************************************************************  Until we have proper leadership, clean up the lobby process, and truly have transparency and accountability, our democracies (Canada & US) are a farce. Our politicians are already sold out before they are even allowed to run. Look what happens in the US when a Congressperson, or even a President, dares speak the truth and works for the national interest instead of the corporate agenda. What happened to banking reforms? A farce I say, a farce.
CommentKey:8303e9e7-5dc1-4368-a4b6-cbe0b09f7f9d	2000415835	Mon Feb 14 2011 09:46:41 GMT-0500 (EST)	gnossos	1	@wwwang: The population of Egypt is 10 billlion people now? Is that how Mubarak was able to buy so many votes?
CommentKey:f1190f4e-f46e-4cd4-9ff8-6863996c6915	2000415835	Mon Feb 14 2011 09:48:31 GMT-0500 (EST)	Kyperioth	3	@1moreside  Obviously you didn't read the whole article, it clearly say after that:  "The military leadership also said it would form a committee to amend the constitution and set the rules for popular referendum to endorse the amendments"  Read the damn article before you start blabbing.  As for the our system, it's broken and it clearly isn't going to get better. Why you ask? well, that's because the people that don't vote or don't want to vote simply don't care whole runs this country job (I've heard this one before, "all the parties look the same and have similar values, none of my own").  Even when they don't have an opinion or preference, they simple don't have the time or the will to vote.  Maybe if the government imposes military-law or prorogues parliment a few more times maybe that might wake some people up enough to vote.
CommentKey:34cd1f54-f775-4f4f-974f-50db63b66b89	2000415835	Mon Feb 14 2011 09:51:41 GMT-0500 (EST)	spreadnolies	4	Makes you wonder if perhaps some of the higher ranking military officials who weren't in line for the throne might have been behind all this. The reaction of the military during the protests vs their actions now...quite different now that Mubarak is gone.
CommentKey:6c7370fc-4437-4086-acf8-e41dc6c13590	2000415835	Mon Feb 14 2011 09:59:02 GMT-0500 (EST)	RAMBO1999	5	I cringe at the thought of Prime minister Layton or Prime Minister Ignatieff !!!! Can you just imagine that Obama Harper ? I will take Prime Minister Harper ANY DAY !!!!!!!
CommentKey:dd2f0232-2bfa-4911-a0c1-39eccfd1ce92	2000415835	Mon Feb 14 2011 10:01:22 GMT-0500 (EST)	1avali	5	Army should listen to people's revolution, not the other way around.
CommentKey:359d3fb4-bc8a-4d6e-a4f5-1c610ab8d932	2000415835	Mon Feb 14 2011 10:07:14 GMT-0500 (EST)	Cockroach King	3	As the old saying goes, "Be careful what you wish for."  Where Mubarak clothed the military in respectable politcal garb, today, with Mubarak gone, Egyptians now answer to the military hand directly.  Boo ya! Who knew?   LOL
CommentKey:7d7aead5-9c3d-45f3-8438-11b53321ae05	2000415835	Mon Feb 14 2011 10:12:06 GMT-0500 (EST)	Ruralife	1	Whatever economy you had before is not in shambles and the military is in charge...YAAA!
CommentKey:d1469192-3173-48e3-ab84-d33e4db348cc	2000415835	Mon Feb 14 2011 10:15:40 GMT-0500 (EST)	criterion	4	1moreside wrote: The military has dissolved parliament, suspended the constitution & will be amending the constitution – without the input of voters or elected officials. I may be a bit slow, but isn’t this called a Military Coup?   Correct.  It is a military coup and it's probably the army that will pick the next leader, president, dictator, despot whatever and he will rule like his predecessors: with an iron fist.  The Egyptian parliament was a useless institution, during the crisis, it was so silent that we did not even know that there was an Egyptian parliament.  And this total silence and passivity coming from an Egyptian parliament in 2011 is so unlike the English parliament that adopted the English Bill of Rights on December 16, 1689.  England in 1689, now that was a Revolution when the English parliament limited the powers of the kings and laid out the basis of our freedoms and liberties.    Sure there will be more riots and demonstrations in the Arab world but they will all end like Egypt: the Army will step in and put a lid on it.    Lesson for anarchists: You cannot change the world by marching up and down the streets like the Egyptians have done for the last three weeks.
CommentKey:8bab0a7f-747d-481a-93fc-e5f4d70c23aa	2000415835	Mon Feb 14 2011 10:18:12 GMT-0500 (EST)	tman2610	5	Funny everyone here forgets the people wanted Mubarak out and were very happy to have the military in control until September. And you need to get your news outside of CBC. It's well known this was a coup. Not a violent one but the morning after Mubarak gave his speech that he wouldn't hand over power, the most likely scenario was the military wouldn't fire on its own people so they asked Mubarak to leave without any blood loss. Quit griping and give the people and military a chance to resolve their own problems as they've agreed whether you like it or not. Or would you prefer the USA step in and its "cronies" as so many complain about?
CommentKey:f6402893-6a9e-4796-9a24-b153cba4f3c3	2000415835	Mon Feb 14 2011 10:20:07 GMT-0500 (EST)	mtltechwriter	3	Shades of the Iranian 'democratic' revolution repeating now in Egypt. Don't be surprised that the extremist Muslim Brotherhood in a coalition with Iran and the Egyptian military form the new 'gooberment' very soon!
CommentKey:e654a8e2-6b17-4f05-afb2-e4bd3378380f	2000415835	Mon Feb 14 2011 10:20:09 GMT-0500 (EST)	bclion	12	It remains to be seen whether the military is just restoring some order, or imposing order.  If the military promotes democratic reforms, and allows fair elections, it will be one of the few times a military regime has done this.  Not saying it couldn't happen, just saying it would be unusual.  If the military fires on crowds, imprisons protesters, tortures prisoners, to whom do they answer?  Certainly not to a civilian court of law, or a parliament.  The only good news here is that the world is watching, and is firmly on the side of the Egyptian people.
CommentKey:904ffdce-e57f-4ec2-9298-d4a2a8512b98	2000415835	Mon Feb 14 2011 10:22:22 GMT-0500 (EST)	Trajan	6	They should probably leave the Square then. What are they going to do? The military is not Mubarak, they aren't going to hop a flight out of the country due to protesters in the Square. They run the country. It appears the sequence is to go like this: Dictator------->Military Oligarchy------->Democracy. I just hope it doesn't get stalled somewhere in the middle. Cheers.
CommentKey:b5b1d55d-04fc-4781-80d8-1a6ff39e03ed	2000415835	Mon Feb 14 2011 10:22:40 GMT-0500 (EST)	Larry O	6	Mudarak is out the Military is in, the Foreign Press has been told to leave. This feels like Iran 1979 all over again with the Muslim Brotherhood ready to step in and offer it's Political/Religious guidance. I hope that Egypt does become another Iran.
CommentKey:eab8eec8-0865-47ab-badb-311bd1b6476f	2000415835	Mon Feb 14 2011 10:30:43 GMT-0500 (EST)	spreadnolies	2	wwwang says: "And yet by most estimates the crowd of protesters was only 250,000 - 350,000 or less than .003% of Egypts population" ***********************************************************************************  Wrong again wwwang. MOST Egyptians support change. Only some of the wealthy were happy with the Mubarak status quo.  Why is it you don't seem enthusiastic about greater freedoms for people?  Do you or don't you like freedom and democracy?
CommentKey:c8eea71c-6225-40d9-980c-eca9227c03fc	2000415835	Mon Feb 14 2011 10:37:41 GMT-0500 (EST)	fixer1	2	It does not matter the numbers that were openly taking part in this. We know that in the hearts and minds of the Egyptian people the vast majority were very much in favour of the regieme change and to new democracy. That is what has been achieved and anyone to claim other wise is a complete and total idiot who does nto even understand life going on around them.   The army has shown very good restraint in not being used as an agent of violence and it is they who actuallly allowed this all to happen. Even though they have now been given the power to run that country, they are holding up the values that the protestors called for and have now set in motion the workings for free and fair elections in 6 months time. This shows us that they are more then willing to be an army within the democracy of the new government. The Eqyptian people should not be afraid to vote. In fact they shopuld be proud to vote and they need to be informed of all the candidates and vote for the ones who will best represent their own values. The 40% of the people who used to live on $2 a day will now be able to get way more and yes the poorest will have a lot more money after this is all settled. The people of the Mubarak regieme will all be thrown out of their high paying civil service jobs and the people who will then work for much less will take on those positions and more workers will then be hired to give jobs with reasonable pay. This will allow many more jobs for the young educated people of this country. That will give them hope. The facts seem to be that much of Egypt was ruled by an eleite class and they suppressed the lower class. These elitists will now be vanquished and their money siezed by the state and it will go a long way to be redistributed to the poor to be a 3 class system.
